"No.","Time","Source","Destination","Protocol","Length","Info"
"1","0.000000000","10.0.0.1","10.0.0.6","TCP","70","33262  >  12345 [PSH, ACK] Seq=1 Ack=1 Win=83 Len=4 TSval=1296910117 TSecr=2029465555"
"2","0.000027307","10.0.0.6","10.0.0.1","TCP","66","12345  >  33262 [ACK] Seq=1 Ack=5 Win=85 Len=0 TSval=2029467770 TSecr=1296910117"
"3","0.000041944","10.0.0.1","10.0.0.6","TCP","70","33262  >  12345 [PSH, ACK] Seq=5 Ack=1 Win=83 Len=4 TSval=1296910117 TSecr=2029467770"
"4","0.000050490","10.0.0.6","10.0.0.1","TCP","66","12345  >  33262 [ACK] Seq=1 Ack=9 Win=85 Len=0 TSval=2029467770 TSecr=1296910117"
"5","0.000059682","10.0.0.1","10.0.0.6","TCP","67","33262  >  12345 [PSH, ACK] Seq=9 Ack=1 Win=83 Len=1 TSval=1296910117 TSecr=2029467770"
"6","0.000066170","10.0.0.6","10.0.0.1","TCP","66","12345  >  33262 [ACK] Seq=1 Ack=10 Win=85 Len=0 TSval=2029467770 TSecr=1296910117"
"7","0.000073525","10.0.0.1","10.0.0.6","TCP","92","33262  >  12345 [PSH, ACK] Seq=10 Ack=1 Win=83 Len=26 TSval=1296910117 TSecr=2029467770"
"8","0.000079449","10.0.0.6","10.0.0.1","TCP","66","12345  >  33262 [ACK] Seq=1 Ack=36 Win=85 Len=0 TSval=2029467770 TSecr=1296910117"
"9","2.221273115","10.0.0.6","10.0.0.1","TCP","70","12345  >  33262 [PSH, ACK] Seq=1 Ack=36 Win=85 Len=4 TSval=2029469991 TSecr=1296910117"
"10","2.221292970","10.0.0.1","10.0.0.6","TCP","66","33262  >  12345 [ACK] Seq=36 Ack=5 Win=83 Len=0 TSval=1296912338 TSecr=2029469991"
"11","2.221309487","10.0.0.6","10.0.0.1","TCP","70","12345  >  33262 [PSH, ACK] Seq=5 Ack=36 Win=85 Len=4 TSval=2029469991 TSecr=1296912338"
"12","2.221315209","10.0.0.1","10.0.0.6","TCP","66","33262  >  12345 [ACK] Seq=36 Ack=9 Win=83 Len=0 TSval=1296912338 TSecr=2029469991"
"13","2.221325558","10.0.0.6","10.0.0.1","TCP","67","12345  >  33262 [PSH, ACK] Seq=9 Ack=36 Win=85 Len=1 TSval=2029469991 TSecr=1296912338"
"14","2.221330162","10.0.0.1","10.0.0.6","TCP","66","33262  >  12345 [ACK] Seq=36 Ack=10 Win=83 Len=0 TSval=1296912338 TSecr=2029469991"
"15","2.221339336","10.0.0.6","10.0.0.1","TCP","90","12345  >  33262 [PSH, ACK] Seq=10 Ack=36 Win=85 Len=24 TSval=2029469991 TSecr=1296912338"
"16","2.221343644","10.0.0.1","10.0.0.6","TCP","66","33262  >  12345 [ACK] Seq=36 Ack=34 Win=83 Len=0 TSval=1296912338 TSecr=2029469991"
"17","4.449444750","10.0.0.1","10.0.0.6","TCP","70","33262  >  12345 [PSH, ACK] Seq=36 Ack=34 Win=83 Len=4 TSval=1296914566 TSecr=2029469991"
"18","4.449480514","10.0.0.6","10.0.0.1","TCP","66","12345  >  33262 [ACK] Seq=34 Ack=40 Win=85 Len=0 TSval=2029472219 TSecr=1296914566"
"19","4.449498292","10.0.0.1","10.0.0.6","TCP","70","33262  >  12345 [PSH, ACK] Seq=40 Ack=34 Win=83 Len=4 TSval=1296914566 TSecr=2029472219"
"20","4.449505724","10.0.0.6","10.0.0.1","TCP","66","12345  >  33262 [ACK] Seq=34 Ack=44 Win=85 Len=0 TSval=2029472219 TSecr=1296914566"
"21","4.449514401","10.0.0.1","10.0.0.6","TCP","67","33262  >  12345 [PSH, ACK] Seq=44 Ack=34 Win=83 Len=1 TSval=1296914566 TSecr=2029472219"
"22","4.449520540","10.0.0.6","10.0.0.1","TCP","66","12345  >  33262 [ACK] Seq=34 Ack=45 Win=85 Len=0 TSval=2029472219 TSecr=1296914566"
"23","4.449528234","10.0.0.1","10.0.0.6","TCP","92","33262  >  12345 [PSH, ACK] Seq=45 Ack=34 Win=83 Len=26 TSval=1296914566 TSecr=2029472219"
"24","4.449534916","10.0.0.6","10.0.0.1","TCP","66","12345  >  33262 [ACK] Seq=34 Ack=71 Win=85 Len=0 TSval=2029472219 TSecr=1296914566"
"25","6.666933458","10.0.0.6","10.0.0.1","TCP","70","12345  >  33262 [PSH, ACK] Seq=34 Ack=71 Win=85 Len=4 TSval=2029474437 TSecr=1296914566"
"26","6.666953983","10.0.0.1","10.0.0.6","TCP","66","33262  >  12345 [ACK] Seq=71 Ack=38 Win=83 Len=0 TSval=1296916784 TSecr=2029474437"
"27","6.666976768","10.0.0.6","10.0.0.1","TCP","70","12345  >  33262 [PSH, ACK] Seq=38 Ack=71 Win=85 Len=4 TSval=2029474437 TSecr=1296916784"
"28","6.666982638","10.0.0.1","10.0.0.6","TCP","66","33262  >  12345 [ACK] Seq=71 Ack=42 Win=83 Len=0 TSval=1296916784 TSecr=2029474437"
"29","6.666993093","10.0.0.6","10.0.0.1","TCP","67","12345  >  33262 [PSH, ACK] Seq=42 Ack=71 Win=85 Len=1 TSval=2029474437 TSecr=1296916784"
"30","6.666997723","10.0.0.1","10.0.0.6","TCP","66","33262  >  12345 [ACK] Seq=71 Ack=43 Win=83 Len=0 TSval=1296916784 TSecr=2029474437"
"31","6.667006569","10.0.0.6","10.0.0.1","TCP","90","12345  >  33262 [PSH, ACK] Seq=43 Ack=71 Win=85 Len=24 TSval=2029474437 TSecr=1296916784"
"32","6.667010810","10.0.0.1","10.0.0.6","TCP","66","33262  >  12345 [ACK] Seq=71 Ack=67 Win=83 Len=0 TSval=1296916784 TSecr=2029474437"
"33","8.897235569","10.0.0.1","10.0.0.6","TCP","70","33262  >  12345 [PSH, ACK] Seq=71 Ack=67 Win=83 Len=4 TSval=1296919014 TSecr=2029474437"
"34","8.897267123","10.0.0.6","10.0.0.1","TCP","66","12345  >  33262 [ACK] Seq=67 Ack=75 Win=85 Len=0 TSval=2029476667 TSecr=1296919014"
"35","8.897294635","10.0.0.1","10.0.0.6","TCP","70","33262  >  12345 [PSH, ACK] Seq=75 Ack=67 Win=83 Len=4 TSval=1296919014 TSecr=2029476667"
"36","8.897308547","10.0.0.6","10.0.0.1","TCP","66","12345  >  33262 [ACK] Seq=67 Ack=79 Win=85 Len=0 TSval=2029476667 TSecr=1296919014"
"37","8.897318864","10.0.0.1","10.0.0.6","TCP","67","33262  >  12345 [PSH, ACK] Seq=79 Ack=67 Win=83 Len=1 TSval=1296919014 TSecr=2029476667"
"38","8.897330906","10.0.0.6","10.0.0.1","TCP","66","12345  >  33262 [ACK] Seq=67 Ack=80 Win=85 Len=0 TSval=2029476667 TSecr=1296919014"
"39","8.897339904","10.0.0.1","10.0.0.6","TCP","92","33262  >  12345 [PSH, ACK] Seq=80 Ack=67 Win=83 Len=26 TSval=1296919014 TSecr=2029476667"
"40","8.897346286","10.0.0.6","10.0.0.1","TCP","66","12345  >  33262 [ACK] Seq=67 Ack=106 Win=85 Len=0 TSval=2029476667 TSecr=1296919014"
"41","11.112637870","10.0.0.6","10.0.0.1","TCP","70","12345  >  33262 [PSH, ACK] Seq=67 Ack=106 Win=85 Len=4 TSval=2029478882 TSecr=1296919014"
"42","11.112655603","10.0.0.1","10.0.0.6","TCP","66","33262  >  12345 [ACK] Seq=106 Ack=71 Win=83 Len=0 TSval=1296921229 TSecr=2029478882"
"43","11.112669262","10.0.0.6","10.0.0.1","TCP","70","12345  >  33262 [PSH, ACK] Seq=71 Ack=106 Win=85 Len=4 TSval=2029478882 TSecr=1296921229"
"44","11.112674476","10.0.0.1","10.0.0.6","TCP","66","33262  >  12345 [ACK] Seq=106 Ack=75 Win=83 Len=0 TSval=1296921229 TSecr=2029478882"
"45","11.112683608","10.0.0.6","10.0.0.1","TCP","67","12345  >  33262 [PSH, ACK] Seq=75 Ack=106 Win=85 Len=1 TSval=2029478882 TSecr=1296921229"
"46","11.112688054","10.0.0.1","10.0.0.6","TCP","66","33262  >  12345 [ACK] Seq=106 Ack=76 Win=83 Len=0 TSval=1296921229 TSecr=2029478882"
"47","11.112696848","10.0.0.6","10.0.0.1","TCP","90","12345  >  33262 [PSH, ACK] Seq=76 Ack=106 Win=85 Len=24 TSval=2029478882 TSecr=1296921229"
"48","11.112701134","10.0.0.1","10.0.0.6","TCP","66","33262  >  12345 [ACK] Seq=106 Ack=100 Win=83 Len=0 TSval=1296921229 TSecr=2029478882"
"49","13.326804259","10.0.0.1","10.0.0.6","TCP","70","33262  >  12345 [PSH, ACK] Seq=106 Ack=100 Win=83 Len=4 TSval=1296923443 TSecr=2029478882"
"50","13.326831539","10.0.0.6","10.0.0.1","TCP","66","12345  >  33262 [ACK] Seq=100 Ack=110 Win=85 Len=0 TSval=2029481096 TSecr=1296923443"
"51","13.326845922","10.0.0.1","10.0.0.6","TCP","70","33262  >  12345 [PSH, ACK] Seq=110 Ack=100 Win=83 Len=4 TSval=1296923444 TSecr=2029481096"
"52","13.326853783","10.0.0.6","10.0.0.1","TCP","66","12345  >  33262 [ACK] Seq=100 Ack=114 Win=85 Len=0 TSval=2029481097 TSecr=1296923444"
"53","13.326862463","10.0.0.1","10.0.0.6","TCP","67","33262  >  12345 [PSH, ACK] Seq=114 Ack=100 Win=83 Len=1 TSval=1296923444 TSecr=2029481097"
"54","13.326868593","10.0.0.6","10.0.0.1","TCP","66","12345  >  33262 [ACK] Seq=100 Ack=115 Win=85 Len=0 TSval=2029481097 TSecr=1296923444"
"55","13.326876070","10.0.0.1","10.0.0.6","TCP","92","33262  >  12345 [PSH, ACK] Seq=115 Ack=100 Win=83 Len=26 TSval=1296923444 TSecr=2029481097"
"56","13.326882070","10.0.0.6","10.0.0.1","TCP","66","12345  >  33262 [ACK] Seq=100 Ack=141 Win=85 Len=0 TSval=2029481097 TSecr=1296923444"
"57","15.547873562","10.0.0.6","10.0.0.1","TCP","70","12345  >  33262 [PSH, ACK] Seq=100 Ack=141 Win=85 Len=4 TSval=2029483318 TSecr=1296923444"
"58","15.547894005","10.0.0.1","10.0.0.6","TCP","66","33262  >  12345 [ACK] Seq=141 Ack=104 Win=83 Len=0 TSval=1296925665 TSecr=2029483318"
"59","15.547908884","10.0.0.6","10.0.0.1","TCP","70","12345  >  33262 [PSH, ACK] Seq=104 Ack=141 Win=85 Len=4 TSval=2029483318 TSecr=1296925665"
"60","15.547914366","10.0.0.1","10.0.0.6","TCP","66","33262  >  12345 [ACK] Seq=141 Ack=108 Win=83 Len=0 TSval=1296925665 TSecr=2029483318"
"61","15.547924067","10.0.0.6","10.0.0.1","TCP","67","12345  >  33262 [PSH, ACK] Seq=108 Ack=141 Win=85 Len=1 TSval=2029483318 TSecr=1296925665"
"62","15.547928588","10.0.0.1","10.0.0.6","TCP","66","33262  >  12345 [ACK] Seq=141 Ack=109 Win=83 Len=0 TSval=1296925665 TSecr=2029483318"
"63","15.547937668","10.0.0.6","10.0.0.1","TCP","90","12345  >  33262 [PSH, ACK] Seq=109 Ack=141 Win=85 Len=24 TSval=2029483318 TSecr=1296925665"
"64","15.547941923","10.0.0.1","10.0.0.6","TCP","66","33262  >  12345 [ACK] Seq=141 Ack=133 Win=83 Len=0 TSval=1296925665 TSecr=2029483318"
"65","17.803603961","10.0.0.1","10.0.0.6","TCP","70","33262  >  12345 [PSH, ACK] Seq=141 Ack=133 Win=83 Len=4 TSval=1296927920 TSecr=2029483318"
"66","17.803633532","10.0.0.6","10.0.0.1","TCP","66","12345  >  33262 [ACK] Seq=133 Ack=145 Win=85 Len=0 TSval=2029485573 TSecr=1296927920"
"67","17.803648953","10.0.0.1","10.0.0.6","TCP","70","33262  >  12345 [PSH, ACK] Seq=145 Ack=133 Win=83 Len=4 TSval=1296927920 TSecr=2029485573"
"68","17.803656980","10.0.0.6","10.0.0.1","TCP","66","12345  >  33262 [ACK] Seq=133 Ack=149 Win=85 Len=0 TSval=2029485573 TSecr=1296927920"
"69","17.803666217","10.0.0.1","10.0.0.6","TCP","67","33262  >  12345 [PSH, ACK] Seq=149 Ack=133 Win=83 Len=1 TSval=1296927920 TSecr=2029485573"
"70","17.803672241","10.0.0.6","10.0.0.1","TCP","66","12345  >  33262 [ACK] Seq=133 Ack=150 Win=85 Len=0 TSval=2029485573 TSecr=1296927920"
"71","17.803679334","10.0.0.1","10.0.0.6","TCP","92","33262  >  12345 [PSH, ACK] Seq=150 Ack=133 Win=83 Len=26 TSval=1296927920 TSecr=2029485573"
"72","17.803685212","10.0.0.6","10.0.0.1","TCP","66","12345  >  33262 [ACK] Seq=133 Ack=176 Win=85 Len=0 TSval=2029485573 TSecr=1296927920"
"73","20.019738031","10.0.0.6","10.0.0.1","TCP","70","12345  >  33262 [PSH, ACK] Seq=133 Ack=176 Win=85 Len=4 TSval=2029487789 TSecr=1296927920"
"74","20.019757721","10.0.0.1","10.0.0.6","TCP","66","33262  >  12345 [ACK] Seq=176 Ack=137 Win=83 Len=0 TSval=1296930136 TSecr=2029487789"
"75","20.019773905","10.0.0.6","10.0.0.1","TCP","70","12345  >  33262 [PSH, ACK] Seq=137 Ack=176 Win=85 Len=4 TSval=2029487789 TSecr=1296930136"
"76","20.019779859","10.0.0.1","10.0.0.6","TCP","66","33262  >  12345 [ACK] Seq=176 Ack=141 Win=83 Len=0 TSval=1296930136 TSecr=2029487789"
"77","20.019789827","10.0.0.6","10.0.0.1","TCP","67","12345  >  33262 [PSH, ACK] Seq=141 Ack=176 Win=85 Len=1 TSval=2029487789 TSecr=1296930136"
"78","20.019794415","10.0.0.1","10.0.0.6","TCP","66","33262  >  12345 [ACK] Seq=176 Ack=142 Win=83 Len=0 TSval=1296930136 TSecr=2029487789"
"79","20.019803175","10.0.0.6","10.0.0.1","TCP","90","12345  >  33262 [PSH, ACK] Seq=142 Ack=176 Win=85 Len=24 TSval=2029487789 TSecr=1296930136"
"80","20.019807416","10.0.0.1","10.0.0.6","TCP","66","33262  >  12345 [ACK] Seq=176 Ack=166 Win=83 Len=0 TSval=1296930136 TSecr=2029487789"
"81","21.371737698","fe80::10f5:41ff:fecd:4069","ff02::2","ICMPv6","70","Router Solicitation from 12:f5:41:cd:40:69"
"82","22.247732705","10.0.0.1","10.0.0.6","TCP","70","33262  >  12345 [PSH, ACK] Seq=176 Ack=166 Win=83 Len=4 TSval=1296932364 TSecr=2029487789"
"83","22.247763478","10.0.0.6","10.0.0.1","TCP","66","12345  >  33262 [ACK] Seq=166 Ack=180 Win=85 Len=0 TSval=2029490017 TSecr=1296932364"
"84","22.247778765","10.0.0.1","10.0.0.6","TCP","70","33262  >  12345 [PSH, ACK] Seq=180 Ack=166 Win=83 Len=4 TSval=1296932364 TSecr=2029490017"
"85","22.247786815","10.0.0.6","10.0.0.1","TCP","66","12345  >  33262 [ACK] Seq=166 Ack=184 Win=85 Len=0 TSval=2029490017 TSecr=1296932364"
"86","22.247796081","10.0.0.1","10.0.0.6","TCP","67","33262  >  12345 [PSH, ACK] Seq=184 Ack=166 Win=83 Len=1 TSval=1296932364 TSecr=2029490017"
"87","22.247802719","10.0.0.6","10.0.0.1","TCP","66","12345  >  33262 [ACK] Seq=166 Ack=185 Win=85 Len=0 TSval=2029490017 TSecr=1296932364"
"88","22.247810332","10.0.0.1","10.0.0.6","TCP","92","33262  >  12345 [PSH, ACK] Seq=185 Ack=166 Win=83 Len=26 TSval=1296932364 TSecr=2029490017"
"89","22.247816674","10.0.0.6","10.0.0.1","TCP","66","12345  >  33262 [ACK] Seq=166 Ack=211 Win=85 Len=0 TSval=2029490017 TSecr=1296932364"
"90","23.419694044","fe80::3c28:b9ff:fe0d:3450","ff02::2","ICMPv6","70","Router Solicitation from 3e:28:b9:0d:34:50"
"91","24.483553025","10.0.0.6","10.0.0.1","TCP","70","12345  >  33262 [PSH, ACK] Seq=166 Ack=211 Win=85 Len=4 TSval=2029492253 TSecr=1296932364"
"92","24.483585219","10.0.0.1","10.0.0.6","TCP","66","33262  >  12345 [ACK] Seq=211 Ack=170 Win=83 Len=0 TSval=1296934600 TSecr=2029492253"
"93","24.483604607","10.0.0.6","10.0.0.1","TCP","70","12345  >  33262 [PSH, ACK] Seq=170 Ack=211 Win=85 Len=4 TSval=2029492253 TSecr=1296934600"
"94","24.483611572","10.0.0.1","10.0.0.6","TCP","66","33262  >  12345 [ACK] Seq=211 Ack=174 Win=83 Len=0 TSval=1296934600 TSecr=2029492253"
"95","24.483622201","10.0.0.6","10.0.0.1","TCP","67","12345  >  33262 [PSH, ACK] Seq=174 Ack=211 Win=85 Len=1 TSval=2029492253 TSecr=1296934600"
"96","24.483626857","10.0.0.1","10.0.0.6","TCP","66","33262  >  12345 [ACK] Seq=211 Ack=175 Win=83 Len=0 TSval=1296934600 TSecr=2029492253"
"97","24.483635800","10.0.0.6","10.0.0.1","TCP","90","12345  >  33262 [PSH, ACK] Seq=175 Ack=211 Win=85 Len=24 TSval=2029492253 TSecr=1296934600"
"98","24.483640133","10.0.0.1","10.0.0.6","TCP","66","33262  >  12345 [ACK] Seq=211 Ack=199 Win=83 Len=0 TSval=1296934600 TSecr=2029492253"
"99","25.467764261","fe80::50c3:49ff:fe7b:c916","ff02::2","ICMPv6","70","Router Solicitation from 52:c3:49:7b:c9:16"
"100","25.467804845","fe80::60aa:15ff:fe75:f3ce","ff02::2","ICMPv6","70","Router Solicitation from 62:aa:15:75:f3:ce"
"101","25.467817604","fe80::7c4e:39ff:fe39:b923","ff02::2","ICMPv6","70","Router Solicitation from 7e:4e:39:39:b9:23"
"102","25.467930208","fe80::8880:58ff:fee8:9eda","ff02::2","ICMPv6","70","Router Solicitation from 8a:80:58:e8:9e:da"
"103","26.716089620","10.0.0.1","10.0.0.6","TCP","70","33262  >  12345 [PSH, ACK] Seq=211 Ack=199 Win=83 Len=4 TSval=1296936833 TSecr=2029492253"
"104","26.716116979","10.0.0.6","10.0.0.1","TCP","66","12345  >  33262 [ACK] Seq=199 Ack=215 Win=85 Len=0 TSval=2029494486 TSecr=1296936833"
"105","26.716137944","10.0.0.1","10.0.0.6","TCP","70","33262  >  12345 [PSH, ACK] Seq=215 Ack=199 Win=83 Len=4 TSval=1296936833 TSecr=2029494486"
"106","26.716147030","10.0.0.6","10.0.0.1","TCP","66","12345  >  33262 [ACK] Seq=199 Ack=219 Win=85 Len=0 TSval=2029494486 TSecr=1296936833"
"107","26.716156231","10.0.0.1","10.0.0.6","TCP","67","33262  >  12345 [PSH, ACK] Seq=219 Ack=199 Win=83 Len=1 TSval=1296936833 TSecr=2029494486"
"108","26.716162661","10.0.0.6","10.0.0.1","TCP","66","12345  >  33262 [ACK] Seq=199 Ack=220 Win=85 Len=0 TSval=2029494486 TSecr=1296936833"
"109","26.716170037","10.0.0.1","10.0.0.6","TCP","92","33262  >  12345 [PSH, ACK] Seq=220 Ack=199 Win=83 Len=26 TSval=1296936833 TSecr=2029494486"
"110","26.716176168","10.0.0.6","10.0.0.1","TCP","66","12345  >  33262 [ACK] Seq=199 Ack=246 Win=85 Len=0 TSval=2029494486 TSecr=1296936833"
"111","28.940612103","10.0.0.6","10.0.0.1","TCP","70","12345  >  33262 [PSH, ACK] Seq=199 Ack=246 Win=85 Len=4 TSval=2029496710 TSecr=1296936833"
"112","28.940629478","10.0.0.1","10.0.0.6","TCP","66","33262  >  12345 [ACK] Seq=246 Ack=203 Win=83 Len=0 TSval=1296939057 TSecr=2029496710"
"113","28.940648517","10.0.0.6","10.0.0.1","TCP","70","12345  >  33262 [PSH, ACK] Seq=203 Ack=246 Win=85 Len=4 TSval=2029496710 TSecr=1296939057"
"114","28.940653936","10.0.0.1","10.0.0.6","TCP","66","33262  >  12345 [ACK] Seq=246 Ack=207 Win=83 Len=0 TSval=1296939057 TSecr=2029496710"
"115","28.940663807","10.0.0.6","10.0.0.1","TCP","67","12345  >  33262 [PSH, ACK] Seq=207 Ack=246 Win=85 Len=1 TSval=2029496710 TSecr=1296939057"
"116","28.940668247","10.0.0.1","10.0.0.6","TCP","66","33262  >  12345 [ACK] Seq=246 Ack=208 Win=83 Len=0 TSval=1296939057 TSecr=2029496710"
"117","28.940676815","10.0.0.6","10.0.0.1","TCP","90","12345  >  33262 [PSH, ACK] Seq=208 Ack=246 Win=85 Len=24 TSval=2029496710 TSecr=1296939057"
"118","28.940681118","10.0.0.1","10.0.0.6","TCP","66","33262  >  12345 [ACK] Seq=246 Ack=232 Win=83 Len=0 TSval=1296939057 TSecr=2029496710"
"119","29.563451907","fe80::9c06:38ff:fed4:cf","ff02::2","ICMPv6","70","Router Solicitation from 9e:06:38:d4:00:cf"
"120","31.153997760","10.0.0.1","10.0.0.6","TCP","70","33262  >  12345 [PSH, ACK] Seq=246 Ack=232 Win=83 Len=4 TSval=1296941271 TSecr=2029496710"
"121","31.154031146","10.0.0.6","10.0.0.1","TCP","66","12345  >  33262 [ACK] Seq=232 Ack=250 Win=85 Len=0 TSval=2029498924 TSecr=1296941271"
"122","31.154056122","10.0.0.1","10.0.0.6","TCP","70","33262  >  12345 [PSH, ACK] Seq=250 Ack=232 Win=83 Len=4 TSval=1296941271 TSecr=2029498924"
"123","31.154065178","10.0.0.6","10.0.0.1","TCP","66","12345  >  33262 [ACK] Seq=232 Ack=254 Win=85 Len=0 TSval=2029498924 TSecr=1296941271"
"124","31.154074759","10.0.0.1","10.0.0.6","TCP","67","33262  >  12345 [PSH, ACK] Seq=254 Ack=232 Win=83 Len=1 TSval=1296941271 TSecr=2029498924"
"125","31.154080937","10.0.0.6","10.0.0.1","TCP","66","12345  >  33262 [ACK] Seq=232 Ack=255 Win=85 Len=0 TSval=2029498924 TSecr=1296941271"
"126","31.154088345","10.0.0.1","10.0.0.6","TCP","92","33262  >  12345 [PSH, ACK] Seq=255 Ack=232 Win=83 Len=26 TSval=1296941271 TSecr=2029498924"
"127","31.154094357","10.0.0.6","10.0.0.1","TCP","66","12345  >  33262 [ACK] Seq=232 Ack=281 Win=85 Len=0 TSval=2029498924 TSecr=1296941271"
"128","33.375061440","10.0.0.6","10.0.0.1","TCP","70","12345  >  33262 [PSH, ACK] Seq=232 Ack=281 Win=85 Len=4 TSval=2029501145 TSecr=1296941271"
"129","33.375081944","10.0.0.1","10.0.0.6","TCP","66","33262  >  12345 [ACK] Seq=281 Ack=236 Win=83 Len=0 TSval=1296943492 TSecr=2029501145"
"130","33.375098282","10.0.0.6","10.0.0.1","TCP","70","12345  >  33262 [PSH, ACK] Seq=236 Ack=281 Win=85 Len=4 TSval=2029501145 TSecr=1296943492"
"131","33.375104184","10.0.0.1","10.0.0.6","TCP","66","33262  >  12345 [ACK] Seq=281 Ack=240 Win=83 Len=0 TSval=1296943492 TSecr=2029501145"
"132","33.375114239","10.0.0.6","10.0.0.1","TCP","67","12345  >  33262 [PSH, ACK] Seq=240 Ack=281 Win=85 Len=1 TSval=2029501145 TSecr=1296943492"
"133","33.375118524","10.0.0.1","10.0.0.6","TCP","66","33262  >  12345 [ACK] Seq=281 Ack=241 Win=83 Len=0 TSval=1296943492 TSecr=2029501145"
"134","33.375127516","10.0.0.6","10.0.0.1","TCP","90","12345  >  33262 [PSH, ACK] Seq=241 Ack=281 Win=85 Len=24 TSval=2029501145 TSecr=1296943492"
"135","33.375131666","10.0.0.1","10.0.0.6","TCP","66","33262  >  12345 [ACK] Seq=281 Ack=265 Win=83 Len=0 TSval=1296943492 TSecr=2029501145"
"136","33.659470898","fe80::3825:63ff:fe1a:a60","ff02::2","ICMPv6","70","Router Solicitation from 3a:25:63:1a:0a:60"
"137","35.591823640","10.0.0.1","10.0.0.6","TCP","70","33262  >  12345 [PSH, ACK] Seq=281 Ack=265 Win=83 Len=4 TSval=1296945708 TSecr=2029501145"
"138","35.591858160","10.0.0.6","10.0.0.1","TCP","66","12345  >  33262 [ACK] Seq=265 Ack=285 Win=85 Len=0 TSval=2029503362 TSecr=1296945708"
"139","35.591874527","10.0.0.1","10.0.0.6","TCP","70","33262  >  12345 [PSH, ACK] Seq=285 Ack=265 Win=83 Len=4 TSval=1296945709 TSecr=2029503362"
"140","35.591881803","10.0.0.6","10.0.0.1","TCP","66","12345  >  33262 [ACK] Seq=265 Ack=289 Win=85 Len=0 TSval=2029503362 TSecr=1296945709"
"141","35.591891112","10.0.0.1","10.0.0.6","TCP","67","33262  >  12345 [PSH, ACK] Seq=289 Ack=265 Win=83 Len=1 TSval=1296945709 TSecr=2029503362"
"142","35.591904321","10.0.0.6","10.0.0.1","TCP","66","12345  >  33262 [ACK] Seq=265 Ack=290 Win=85 Len=0 TSval=2029503362 TSecr=1296945709"
"143","35.591913313","10.0.0.1","10.0.0.6","TCP","92","33262  >  12345 [PSH, ACK] Seq=290 Ack=265 Win=83 Len=26 TSval=1296945709 TSecr=2029503362"
"144","35.591925643","10.0.0.6","10.0.0.1","TCP","66","12345  >  33262 [ACK] Seq=265 Ack=316 Win=85 Len=0 TSval=2029503362 TSecr=1296945709"
"145","37.811523918","10.0.0.6","10.0.0.1","TCP","70","12345  >  33262 [PSH, ACK] Seq=265 Ack=316 Win=85 Len=4 TSval=2029505581 TSecr=1296945709"
"146","37.811541131","10.0.0.1","10.0.0.6","TCP","66","33262  >  12345 [ACK] Seq=316 Ack=269 Win=83 Len=0 TSval=1296947928 TSecr=2029505581"
"147","37.811555314","10.0.0.6","10.0.0.1","TCP","70","12345  >  33262 [PSH, ACK] Seq=269 Ack=316 Win=85 Len=4 TSval=2029505581 TSecr=1296947928"
"148","37.811560533","10.0.0.1","10.0.0.6","TCP","66","33262  >  12345 [ACK] Seq=316 Ack=273 Win=83 Len=0 TSval=1296947928 TSecr=2029505581"
"149","37.811570360","10.0.0.6","10.0.0.1","TCP","67","12345  >  33262 [PSH, ACK] Seq=273 Ack=316 Win=85 Len=1 TSval=2029505581 TSecr=1296947928"
"150","37.811574732","10.0.0.1","10.0.0.6","TCP","66","33262  >  12345 [ACK] Seq=316 Ack=274 Win=83 Len=0 TSval=1296947928 TSecr=2029505581"
"151","37.811583292","10.0.0.6","10.0.0.1","TCP","90","12345  >  33262 [PSH, ACK] Seq=274 Ack=316 Win=85 Len=24 TSval=2029505581 TSecr=1296947928"
"152","37.811587600","10.0.0.1","10.0.0.6","TCP","66","33262  >  12345 [ACK] Seq=316 Ack=298 Win=83 Len=0 TSval=1296947928 TSecr=2029505581"
"153","40.102554963","10.0.0.1","10.0.0.6","TCP","70","33262  >  12345 [PSH, ACK] Seq=316 Ack=298 Win=83 Len=4 TSval=1296950219 TSecr=2029505581"
"154","40.102587472","10.0.0.6","10.0.0.1","TCP","66","12345  >  33262 [ACK] Seq=298 Ack=320 Win=85 Len=0 TSval=2029507872 TSecr=1296950219"
"155","40.102602523","10.0.0.1","10.0.0.6","TCP","70","33262  >  12345 [PSH, ACK] Seq=320 Ack=298 Win=83 Len=4 TSval=1296950219 TSecr=2029507872"
"156","40.102610605","10.0.0.6","10.0.0.1","TCP","66","12345  >  33262 [ACK] Seq=298 Ack=324 Win=85 Len=0 TSval=2029507872 TSecr=1296950219"
"157","40.102619490","10.0.0.1","10.0.0.6","TCP","67","33262  >  12345 [PSH, ACK] Seq=324 Ack=298 Win=83 Len=1 TSval=1296950219 TSecr=2029507872"
"158","40.102626095","10.0.0.6","10.0.0.1","TCP","66","12345  >  33262 [ACK] Seq=298 Ack=325 Win=85 Len=0 TSval=2029507872 TSecr=1296950219"
"159","40.102633832","10.0.0.1","10.0.0.6","TCP","92","33262  >  12345 [PSH, ACK] Seq=325 Ack=298 Win=83 Len=26 TSval=1296950219 TSecr=2029507872"
"160","40.102639959","10.0.0.6","10.0.0.1","TCP","66","12345  >  33262 [ACK] Seq=298 Ack=351 Win=85 Len=0 TSval=2029507872 TSecr=1296950219"
"161","42.330555040","10.0.0.6","10.0.0.1","TCP","70","12345  >  33262 [PSH, ACK] Seq=298 Ack=351 Win=85 Len=4 TSval=2029510100 TSecr=1296950219"
"162","42.330572643","10.0.0.1","10.0.0.6","TCP","66","33262  >  12345 [ACK] Seq=351 Ack=302 Win=83 Len=0 TSval=1296952447 TSecr=2029510100"
"163","42.330586421","10.0.0.6","10.0.0.1","TCP","70","12345  >  33262 [PSH, ACK] Seq=302 Ack=351 Win=85 Len=4 TSval=2029510100 TSecr=1296952447"
"164","42.330591925","10.0.0.1","10.0.0.6","TCP","66","33262  >  12345 [ACK] Seq=351 Ack=306 Win=83 Len=0 TSval=1296952447 TSecr=2029510100"
"165","42.330601339","10.0.0.6","10.0.0.1","TCP","67","12345  >  33262 [PSH, ACK] Seq=306 Ack=351 Win=85 Len=1 TSval=2029510100 TSecr=1296952447"
"166","42.330605964","10.0.0.1","10.0.0.6","TCP","66","33262  >  12345 [ACK] Seq=351 Ack=307 Win=83 Len=0 TSval=1296952447 TSecr=2029510100"
"167","42.330614778","10.0.0.6","10.0.0.1","TCP","90","12345  >  33262 [PSH, ACK] Seq=307 Ack=351 Win=85 Len=24 TSval=2029510100 TSecr=1296952447"
"168","42.330619140","10.0.0.1","10.0.0.6","TCP","66","33262  >  12345 [ACK] Seq=351 Ack=331 Win=83 Len=0 TSval=1296952447 TSecr=2029510100"
"169","44.566843621","10.0.0.1","10.0.0.6","TCP","70","33262  >  12345 [PSH, ACK] Seq=351 Ack=331 Win=83 Len=4 TSval=1296954683 TSecr=2029510100"
"170","44.566875975","10.0.0.6","10.0.0.1","TCP","66","12345  >  33262 [ACK] Seq=331 Ack=355 Win=85 Len=0 TSval=2029512337 TSecr=1296954683"
"171","44.566891575","10.0.0.1","10.0.0.6","TCP","70","33262  >  12345 [PSH, ACK] Seq=355 Ack=331 Win=83 Len=4 TSval=1296954684 TSecr=2029512337"
"172","44.566899687","10.0.0.6","10.0.0.1","TCP","66","12345  >  33262 [ACK] Seq=331 Ack=359 Win=85 Len=0 TSval=2029512337 TSecr=1296954684"
"173","44.566908616","10.0.0.1","10.0.0.6","TCP","67","33262  >  12345 [PSH, ACK] Seq=359 Ack=331 Win=83 Len=1 TSval=1296954684 TSecr=2029512337"
"174","44.566914641","10.0.0.6","10.0.0.1","TCP","66","12345  >  33262 [ACK] Seq=331 Ack=360 Win=85 Len=0 TSval=2029512337 TSecr=1296954684"
"175","44.566921941","10.0.0.1","10.0.0.6","TCP","92","33262  >  12345 [PSH, ACK] Seq=360 Ack=331 Win=83 Len=26 TSval=1296954684 TSecr=2029512337"
"176","44.566928030","10.0.0.6","10.0.0.1","TCP","66","12345  >  33262 [ACK] Seq=331 Ack=386 Win=85 Len=0 TSval=2029512337 TSecr=1296954684"
"177","46.797289494","10.0.0.6","10.0.0.1","TCP","70","12345  >  33262 [PSH, ACK] Seq=331 Ack=386 Win=85 Len=4 TSval=2029514567 TSecr=1296954684"
"178","46.797310914","10.0.0.1","10.0.0.6","TCP","66","33262  >  12345 [ACK] Seq=386 Ack=335 Win=83 Len=0 TSval=1296956914 TSecr=2029514567"
"179","46.797326720","10.0.0.6","10.0.0.1","TCP","70","12345  >  33262 [PSH, ACK] Seq=335 Ack=386 Win=85 Len=4 TSval=2029514567 TSecr=1296956914"
"180","46.797332329","10.0.0.1","10.0.0.6","TCP","66","33262  >  12345 [ACK] Seq=386 Ack=339 Win=83 Len=0 TSval=1296956914 TSecr=2029514567"
"181","46.797341890","10.0.0.6","10.0.0.1","TCP","67","12345  >  33262 [PSH, ACK] Seq=339 Ack=386 Win=85 Len=1 TSval=2029514567 TSecr=1296956914"
"182","46.797346341","10.0.0.1","10.0.0.6","TCP","66","33262  >  12345 [ACK] Seq=386 Ack=340 Win=83 Len=0 TSval=1296956914 TSecr=2029514567"
"183","46.797355180","10.0.0.6","10.0.0.1","TCP","90","12345  >  33262 [PSH, ACK] Seq=340 Ack=386 Win=85 Len=24 TSval=2029514567 TSecr=1296956914"
"184","46.797359426","10.0.0.1","10.0.0.6","TCP","66","33262  >  12345 [ACK] Seq=386 Ack=364 Win=83 Len=0 TSval=1296956914 TSecr=2029514567"
"185","49.024473820","10.0.0.1","10.0.0.6","TCP","70","33262  >  12345 [PSH, ACK] Seq=386 Ack=364 Win=83 Len=4 TSval=1296959141 TSecr=2029514567"
"186","49.024502734","10.0.0.6","10.0.0.1","TCP","66","12345  >  33262 [ACK] Seq=364 Ack=390 Win=85 Len=0 TSval=2029516794 TSecr=1296959141"
"187","49.024516632","10.0.0.1","10.0.0.6","TCP","70","33262  >  12345 [PSH, ACK] Seq=390 Ack=364 Win=83 Len=4 TSval=1296959141 TSecr=2029516794"
"188","49.024524546","10.0.0.6","10.0.0.1","TCP","66","12345  >  33262 [ACK] Seq=364 Ack=394 Win=85 Len=0 TSval=2029516794 TSecr=1296959141"
"189","49.024535690","10.0.0.1","10.0.0.6","TCP","67","33262  >  12345 [PSH, ACK] Seq=394 Ack=364 Win=83 Len=1 TSval=1296959141 TSecr=2029516794"
"190","49.024542122","10.0.0.6","10.0.0.1","TCP","66","12345  >  33262 [ACK] Seq=364 Ack=395 Win=85 Len=0 TSval=2029516794 TSecr=1296959141"
"191","49.024549298","10.0.0.1","10.0.0.6","TCP","92","33262  >  12345 [PSH, ACK] Seq=395 Ack=364 Win=83 Len=26 TSval=1296959141 TSecr=2029516794"
"192","49.024555639","10.0.0.6","10.0.0.1","TCP","66","12345  >  33262 [ACK] Seq=364 Ack=421 Win=85 Len=0 TSval=2029516794 TSecr=1296959141"
"193","51.264191105","10.0.0.6","10.0.0.1","TCP","70","12345  >  33262 [PSH, ACK] Seq=364 Ack=421 Win=85 Len=4 TSval=2029519034 TSecr=1296959141"
"194","51.264211075","10.0.0.1","10.0.0.6","TCP","66","33262  >  12345 [ACK] Seq=421 Ack=368 Win=83 Len=0 TSval=1296961381 TSecr=2029519034"
"195","51.264226888","10.0.0.6","10.0.0.1","TCP","70","12345  >  33262 [PSH, ACK] Seq=368 Ack=421 Win=85 Len=4 TSval=2029519034 TSecr=1296961381"
"196","51.264233118","10.0.0.1","10.0.0.6","TCP","66","33262  >  12345 [ACK] Seq=421 Ack=372 Win=83 Len=0 TSval=1296961381 TSecr=2029519034"
"197","51.264243189","10.0.0.6","10.0.0.1","TCP","67","12345  >  33262 [PSH, ACK] Seq=372 Ack=421 Win=85 Len=1 TSval=2029519034 TSecr=1296961381"
"198","51.264247685","10.0.0.1","10.0.0.6","TCP","66","33262  >  12345 [ACK] Seq=421 Ack=373 Win=83 Len=0 TSval=1296961381 TSecr=2029519034"
"199","51.264256754","10.0.0.6","10.0.0.1","TCP","90","12345  >  33262 [PSH, ACK] Seq=373 Ack=421 Win=85 Len=24 TSval=2029519034 TSecr=1296961381"
"200","51.264261131","10.0.0.1","10.0.0.6","TCP","66","33262  >  12345 [ACK] Seq=421 Ack=397 Win=83 Len=0 TSval=1296961381 TSecr=2029519034"
"201","53.484915982","10.0.0.1","10.0.0.6","TCP","70","33262  >  12345 [PSH, ACK] Seq=421 Ack=397 Win=83 Len=4 TSval=1296963602 TSecr=2029519034"
"202","53.484946164","10.0.0.6","10.0.0.1","TCP","66","12345  >  33262 [ACK] Seq=397 Ack=425 Win=85 Len=0 TSval=2029521255 TSecr=1296963602"
"203","53.484960398","10.0.0.1","10.0.0.6","TCP","70","33262  >  12345 [PSH, ACK] Seq=425 Ack=397 Win=83 Len=4 TSval=1296963602 TSecr=2029521255"
"204","53.484968656","10.0.0.6","10.0.0.1","TCP","66","12345  >  33262 [ACK] Seq=397 Ack=429 Win=85 Len=0 TSval=2029521255 TSecr=1296963602"
"205","53.484977924","10.0.0.1","10.0.0.6","TCP","67","33262  >  12345 [PSH, ACK] Seq=429 Ack=397 Win=83 Len=1 TSval=1296963602 TSecr=2029521255"
"206","53.484983975","10.0.0.6","10.0.0.1","TCP","66","12345  >  33262 [ACK] Seq=397 Ack=430 Win=85 Len=0 TSval=2029521255 TSecr=1296963602"
"207","53.484991417","10.0.0.1","10.0.0.6","TCP","92","33262  >  12345 [PSH, ACK] Seq=430 Ack=397 Win=83 Len=26 TSval=1296963602 TSecr=2029521255"
"208","53.484997380","10.0.0.6","10.0.0.1","TCP","66","12345  >  33262 [ACK] Seq=397 Ack=456 Win=85 Len=0 TSval=2029521255 TSecr=1296963602"
"209","55.703484905","10.0.0.6","10.0.0.1","TCP","70","12345  >  33262 [PSH, ACK] Seq=397 Ack=456 Win=85 Len=4 TSval=2029523473 TSecr=1296963602"
"210","55.703509185","10.0.0.1","10.0.0.6","TCP","66","33262  >  12345 [ACK] Seq=456 Ack=401 Win=83 Len=0 TSval=1296965820 TSecr=2029523473"
"211","55.703524614","10.0.0.6","10.0.0.1","TCP","70","12345  >  33262 [PSH, ACK] Seq=401 Ack=456 Win=85 Len=4 TSval=2029523473 TSecr=1296965820"
"212","55.703530580","10.0.0.1","10.0.0.6","TCP","66","33262  >  12345 [ACK] Seq=456 Ack=405 Win=83 Len=0 TSval=1296965820 TSecr=2029523473"
"213","55.703541582","10.0.0.6","10.0.0.1","TCP","67","12345  >  33262 [PSH, ACK] Seq=405 Ack=456 Win=85 Len=1 TSval=2029523473 TSecr=1296965820"
"214","55.703546117","10.0.0.1","10.0.0.6","TCP","66","33262  >  12345 [ACK] Seq=456 Ack=406 Win=83 Len=0 TSval=1296965820 TSecr=2029523473"
"215","55.703555734","10.0.0.6","10.0.0.1","TCP","90","12345  >  33262 [PSH, ACK] Seq=406 Ack=456 Win=85 Len=24 TSval=2029523473 TSecr=1296965820"
"216","55.703560011","10.0.0.1","10.0.0.6","TCP","66","33262  >  12345 [ACK] Seq=456 Ack=430 Win=83 Len=0 TSval=1296965820 TSecr=2029523473"
"217","57.923690033","10.0.0.1","10.0.0.6","TCP","70","33262  >  12345 [PSH, ACK] Seq=456 Ack=430 Win=83 Len=4 TSval=1296968040 TSecr=2029523473"
"218","57.923716851","10.0.0.6","10.0.0.1","TCP","66","12345  >  33262 [ACK] Seq=430 Ack=460 Win=85 Len=0 TSval=2029525693 TSecr=1296968040"
"219","57.923733027","10.0.0.1","10.0.0.6","TCP","70","33262  >  12345 [PSH, ACK] Seq=460 Ack=430 Win=83 Len=4 TSval=1296968040 TSecr=2029525693"
"220","57.923740930","10.0.0.6","10.0.0.1","TCP","66","12345  >  33262 [ACK] Seq=430 Ack=464 Win=85 Len=0 TSval=2029525693 TSecr=1296968040"
"221","57.923749438","10.0.0.1","10.0.0.6","TCP","67","33262  >  12345 [PSH, ACK] Seq=464 Ack=430 Win=83 Len=1 TSval=1296968040 TSecr=2029525693"
"222","57.923755798","10.0.0.6","10.0.0.1","TCP","66","12345  >  33262 [ACK] Seq=430 Ack=465 Win=85 Len=0 TSval=2029525693 TSecr=1296968040"
"223","57.923763010","10.0.0.1","10.0.0.6","TCP","92","33262  >  12345 [PSH, ACK] Seq=465 Ack=430 Win=83 Len=26 TSval=1296968040 TSecr=2029525693"
"224","57.923768942","10.0.0.6","10.0.0.1","TCP","66","12345  >  33262 [ACK] Seq=430 Ack=491 Win=85 Len=0 TSval=2029525693 TSecr=1296968040"
"225","60.143535611","10.0.0.6","10.0.0.1","TCP","70","12345  >  33262 [PSH, ACK] Seq=430 Ack=491 Win=85 Len=4 TSval=2029527913 TSecr=1296968040"
"226","60.143555147","10.0.0.1","10.0.0.6","TCP","66","33262  >  12345 [ACK] Seq=491 Ack=434 Win=83 Len=0 TSval=1296970260 TSecr=2029527913"
"227","60.143570781","10.0.0.6","10.0.0.1","TCP","70","12345  >  33262 [PSH, ACK] Seq=434 Ack=491 Win=85 Len=4 TSval=2029527913 TSecr=1296970260"
"228","60.143576818","10.0.0.1","10.0.0.6","TCP","66","33262  >  12345 [ACK] Seq=491 Ack=438 Win=83 Len=0 TSval=1296970260 TSecr=2029527913"
"229","60.143586141","10.0.0.6","10.0.0.1","TCP","67","12345  >  33262 [PSH, ACK] Seq=438 Ack=491 Win=85 Len=1 TSval=2029527913 TSecr=1296970260"
"230","60.143590606","10.0.0.1","10.0.0.6","TCP","66","33262  >  12345 [ACK] Seq=491 Ack=439 Win=83 Len=0 TSval=1296970260 TSecr=2029527913"
"231","60.143599503","10.0.0.6","10.0.0.1","TCP","90","12345  >  33262 [PSH, ACK] Seq=439 Ack=491 Win=85 Len=24 TSval=2029527913 TSecr=1296970260"
"232","60.143603738","10.0.0.1","10.0.0.6","TCP","66","33262  >  12345 [ACK] Seq=491 Ack=463 Win=83 Len=0 TSval=1296970260 TSecr=2029527913"
"233","62.351945546","10.0.0.1","10.0.0.6","TCP","70","33262  >  12345 [PSH, ACK] Seq=491 Ack=463 Win=83 Len=4 TSval=1296972469 TSecr=2029527913"
"234","62.351979440","10.0.0.6","10.0.0.1","TCP","66","12345  >  33262 [ACK] Seq=463 Ack=495 Win=85 Len=0 TSval=2029530122 TSecr=1296972469"
"235","62.351994817","10.0.0.1","10.0.0.6","TCP","70","33262  >  12345 [PSH, ACK] Seq=495 Ack=463 Win=83 Len=4 TSval=1296972469 TSecr=2029530122"
"236","62.352002508","10.0.0.6","10.0.0.1","TCP","66","12345  >  33262 [ACK] Seq=463 Ack=499 Win=85 Len=0 TSval=2029530122 TSecr=1296972469"
"237","62.352011042","10.0.0.1","10.0.0.6","TCP","67","33262  >  12345 [PSH, ACK] Seq=499 Ack=463 Win=83 Len=1 TSval=1296972469 TSecr=2029530122"
"238","62.352017295","10.0.0.6","10.0.0.1","TCP","66","12345  >  33262 [ACK] Seq=463 Ack=500 Win=85 Len=0 TSval=2029530122 TSecr=1296972469"
"239","62.352024522","10.0.0.1","10.0.0.6","TCP","92","33262  >  12345 [PSH, ACK] Seq=500 Ack=463 Win=83 Len=26 TSval=1296972469 TSecr=2029530122"
"240","62.352030381","10.0.0.6","10.0.0.1","TCP","66","12345  >  33262 [ACK] Seq=463 Ack=526 Win=85 Len=0 TSval=2029530122 TSecr=1296972469"
"241","64.575732407","10.0.0.6","10.0.0.1","TCP","70","12345  >  33262 [PSH, ACK] Seq=463 Ack=526 Win=85 Len=4 TSval=2029532345 TSecr=1296972469"
"242","64.575754480","10.0.0.1","10.0.0.6","TCP","66","33262  >  12345 [ACK] Seq=526 Ack=467 Win=83 Len=0 TSval=1296974692 TSecr=2029532345"
"243","64.575771434","10.0.0.6","10.0.0.1","TCP","70","12345  >  33262 [PSH, ACK] Seq=467 Ack=526 Win=85 Len=4 TSval=2029532345 TSecr=1296974692"
"244","64.575777343","10.0.0.1","10.0.0.6","TCP","66","33262  >  12345 [ACK] Seq=526 Ack=471 Win=83 Len=0 TSval=1296974692 TSecr=2029532345"
"245","64.575792317","10.0.0.6","10.0.0.1","TCP","67","12345  >  33262 [PSH, ACK] Seq=471 Ack=526 Win=85 Len=1 TSval=2029532345 TSecr=1296974692"
"246","64.575797097","10.0.0.1","10.0.0.6","TCP","66","33262  >  12345 [ACK] Seq=526 Ack=472 Win=83 Len=0 TSval=1296974692 TSecr=2029532345"
"247","64.575812293","10.0.0.6","10.0.0.1","TCP","90","12345  >  33262 [PSH, ACK] Seq=472 Ack=526 Win=85 Len=24 TSval=2029532345 TSecr=1296974692"
"248","64.575816497","10.0.0.1","10.0.0.6","TCP","66","33262  >  12345 [ACK] Seq=526 Ack=496 Win=83 Len=0 TSval=1296974692 TSecr=2029532345"
"249","66.801153305","10.0.0.1","10.0.0.6","TCP","70","33262  >  12345 [PSH, ACK] Seq=526 Ack=496 Win=83 Len=4 TSval=1296976918 TSecr=2029532345"
"250","66.801185470","10.0.0.6","10.0.0.1","TCP","66","12345  >  33262 [ACK] Seq=496 Ack=530 Win=85 Len=0 TSval=2029534571 TSecr=1296976918"
"251","66.801201664","10.0.0.1","10.0.0.6","TCP","70","33262  >  12345 [PSH, ACK] Seq=530 Ack=496 Win=83 Len=4 TSval=1296976918 TSecr=2029534571"
"252","66.801209949","10.0.0.6","10.0.0.1","TCP","66","12345  >  33262 [ACK] Seq=496 Ack=534 Win=85 Len=0 TSval=2029534571 TSecr=1296976918"
"253","66.801219039","10.0.0.1","10.0.0.6","TCP","67","33262  >  12345 [PSH, ACK] Seq=534 Ack=496 Win=83 Len=1 TSval=1296976918 TSecr=2029534571"
"254","66.801225871","10.0.0.6","10.0.0.1","TCP","66","12345  >  33262 [ACK] Seq=496 Ack=535 Win=85 Len=0 TSval=2029534571 TSecr=1296976918"
"255","66.801233159","10.0.0.1","10.0.0.6","TCP","92","33262  >  12345 [PSH, ACK] Seq=535 Ack=496 Win=83 Len=26 TSval=1296976918 TSecr=2029534571"
"256","66.801239065","10.0.0.6","10.0.0.1","TCP","66","12345  >  33262 [ACK] Seq=496 Ack=561 Win=85 Len=0 TSval=2029534571 TSecr=1296976918"
"257","69.020925145","10.0.0.6","10.0.0.1","TCP","70","12345  >  33262 [PSH, ACK] Seq=496 Ack=561 Win=85 Len=4 TSval=2029536791 TSecr=1296976918"
"258","69.020945154","10.0.0.1","10.0.0.6","TCP","66","33262  >  12345 [ACK] Seq=561 Ack=500 Win=83 Len=0 TSval=1296979138 TSecr=2029536791"
"259","69.020961567","10.0.0.6","10.0.0.1","TCP","70","12345  >  33262 [PSH, ACK] Seq=500 Ack=561 Win=85 Len=4 TSval=2029536791 TSecr=1296979138"
"260","69.020967591","10.0.0.1","10.0.0.6","TCP","66","33262  >  12345 [ACK] Seq=561 Ack=504 Win=83 Len=0 TSval=1296979138 TSecr=2029536791"
"261","69.020977401","10.0.0.6","10.0.0.1","TCP","67","12345  >  33262 [PSH, ACK] Seq=504 Ack=561 Win=85 Len=1 TSval=2029536791 TSecr=1296979138"
"262","69.020981819","10.0.0.1","10.0.0.6","TCP","66","33262  >  12345 [ACK] Seq=561 Ack=505 Win=83 Len=0 TSval=1296979138 TSecr=2029536791"
"263","69.020990326","10.0.0.6","10.0.0.1","TCP","90","12345  >  33262 [PSH, ACK] Seq=505 Ack=561 Win=85 Len=24 TSval=2029536791 TSecr=1296979138"
"264","69.020994729","10.0.0.1","10.0.0.6","TCP","66","33262  >  12345 [ACK] Seq=561 Ack=529 Win=83 Len=0 TSval=1296979138 TSecr=2029536791"
