"No.","Time","Source","Destination","Protocol","Length","Info"
"1","0.000000000","fe80::3c03:74ff:feb8:e498","ff02::2","ICMPv6","70","Router Solicitation from 3e:03:74:b8:e4:98"
"2","0.255983803","fe80::2cea:cfff:fee0:9950","ff02::2","ICMPv6","70","Router Solicitation from 2e:ea:cf:e0:99:50"
"3","1.792146245","fe80::c45b:2ff:feba:91ea","ff02::2","ICMPv6","70","Router Solicitation from c6:5b:02:ba:91:ea"
"4","3.844040570","fe80::30d9:beff:fe11:9d54","ff02::2","ICMPv6","70","Router Solicitation from 32:d9:be:11:9d:54"
"5","3.844062853","fe80::2d:e7ff:fed3:8742","ff02::2","ICMPv6","70","Router Solicitation from 02:2d:e7:d3:87:42"
"6","3.844089405","fe80::386f:4dff:febd:45a7","ff02::2","ICMPv6","70","Router Solicitation from 3a:6f:4d:bd:45:a7"
"7","7.355754541","10.0.0.1","10.0.0.6","TCP","70","43206  >  12345 [PSH, ACK] Seq=1 Ack=1 Win=83 Len=4 TSval=4205189420 TSecr=3085372909"
"8","7.355785698","10.0.0.1","10.0.0.6","TCP","70","43206  >  12345 [PSH, ACK] Seq=5 Ack=1 Win=83 Len=4 TSval=4205189420 TSecr=3085372909"
"9","7.355787978","10.0.0.1","10.0.0.6","TCP","67","43206  >  12345 [PSH, ACK] Seq=9 Ack=1 Win=83 Len=1 TSval=4205189420 TSecr=3085372909"
"10","7.355789751","10.0.0.1","10.0.0.6","TCP","92","43206  >  12345 [PSH, ACK] Seq=10 Ack=1 Win=83 Len=26 TSval=4205189420 TSecr=3085372909"
"11","7.356008021","10.0.0.6","10.0.0.1","TCP","66","12345  >  43206 [ACK] Seq=1 Ack=5 Win=85 Len=0 TSval=3085384819 TSecr=4205189420"
"12","7.356016234","10.0.0.6","10.0.0.1","TCP","66","12345  >  43206 [ACK] Seq=1 Ack=9 Win=85 Len=0 TSval=3085384819 TSecr=4205189420"
"13","7.356020578","10.0.0.6","10.0.0.1","TCP","66","12345  >  43206 [ACK] Seq=1 Ack=36 Win=85 Len=0 TSval=3085384819 TSecr=4205189420"
"14","7.356549195","10.0.0.6","10.0.0.2","TCP","70","12345  >  51128 [PSH, ACK] Seq=1 Ack=1 Win=85 Len=4 TSval=2581315044 TSecr=4177292791"
"15","7.356675989","10.0.0.2","10.0.0.6","TCP","66","51128  >  12345 [ACK] Seq=1 Ack=5 Win=83 Len=0 TSval=4177304702 TSecr=2581315044"
"16","7.356736819","10.0.0.6","10.0.0.2","TCP","97","12345  >  51128 [PSH, ACK] Seq=5 Ack=1 Win=85 Len=31 TSval=2581315044 TSecr=4177304702"
"17","7.356744481","10.0.0.2","10.0.0.6","TCP","66","51128  >  12345 [ACK] Seq=1 Ack=36 Win=83 Len=0 TSval=4177304702 TSecr=2581315044"
"18","9.562862959","10.0.0.2","10.0.0.6","TCP","70","51128  >  12345 [PSH, ACK] Seq=1 Ack=36 Win=83 Len=4 TSval=4177306908 TSecr=2581315044"
"19","9.562898251","10.0.0.6","10.0.0.2","TCP","66","12345  >  51128 [ACK] Seq=36 Ack=5 Win=85 Len=0 TSval=2581317250 TSecr=4177306908"
"20","9.562928788","10.0.0.2","10.0.0.6","TCP","70","51128  >  12345 [PSH, ACK] Seq=5 Ack=36 Win=83 Len=4 TSval=4177306908 TSecr=2581317250"
"21","9.562934678","10.0.0.6","10.0.0.2","TCP","66","12345  >  51128 [ACK] Seq=36 Ack=9 Win=85 Len=0 TSval=2581317250 TSecr=4177306908"
"22","9.562944903","10.0.0.2","10.0.0.6","TCP","67","51128  >  12345 [PSH, ACK] Seq=9 Ack=36 Win=83 Len=1 TSval=4177306908 TSecr=2581317250"
"23","9.562956397","10.0.0.6","10.0.0.2","TCP","66","12345  >  51128 [ACK] Seq=36 Ack=10 Win=85 Len=0 TSval=2581317250 TSecr=4177306908"
"24","9.562965750","10.0.0.2","10.0.0.6","TCP","90","51128  >  12345 [PSH, ACK] Seq=10 Ack=36 Win=83 Len=24 TSval=4177306908 TSecr=2581317250"
"25","9.562970650","10.0.0.6","10.0.0.2","TCP","66","12345  >  51128 [ACK] Seq=36 Ack=34 Win=85 Len=0 TSval=2581317250 TSecr=4177306908"
"26","9.563132005","10.0.0.6","10.0.0.1","TCP","70","12345  >  43206 [PSH, ACK] Seq=1 Ack=36 Win=85 Len=4 TSval=3085387027 TSecr=4205189420"
"27","9.563161819","10.0.0.1","10.0.0.6","TCP","66","43206  >  12345 [ACK] Seq=36 Ack=5 Win=83 Len=0 TSval=4205191628 TSecr=3085387027"
"28","9.563178205","10.0.0.6","10.0.0.1","TCP","70","12345  >  43206 [PSH, ACK] Seq=5 Ack=36 Win=85 Len=4 TSval=3085387027 TSecr=4205191628"
"29","9.563184451","10.0.0.1","10.0.0.6","TCP","66","43206  >  12345 [ACK] Seq=36 Ack=9 Win=83 Len=0 TSval=4205191628 TSecr=3085387027"
"30","9.563193008","10.0.0.6","10.0.0.1","TCP","67","12345  >  43206 [PSH, ACK] Seq=9 Ack=36 Win=85 Len=1 TSval=3085387027 TSecr=4205191628"
"31","9.563197695","10.0.0.1","10.0.0.6","TCP","66","43206  >  12345 [ACK] Seq=36 Ack=10 Win=83 Len=0 TSval=4205191628 TSecr=3085387027"
"32","9.563204537","10.0.0.6","10.0.0.1","TCP","90","12345  >  43206 [PSH, ACK] Seq=10 Ack=36 Win=85 Len=24 TSval=3085387027 TSecr=4205191628"
"33","9.563208722","10.0.0.1","10.0.0.6","TCP","66","43206  >  12345 [ACK] Seq=36 Ack=34 Win=83 Len=0 TSval=4205191628 TSecr=3085387027"
"34","11.771682757","10.0.0.1","10.0.0.6","TCP","70","43206  >  12345 [PSH, ACK] Seq=36 Ack=34 Win=83 Len=4 TSval=4205193836 TSecr=3085387027"
"35","11.771707267","10.0.0.6","10.0.0.1","TCP","66","12345  >  43206 [ACK] Seq=34 Ack=40 Win=85 Len=0 TSval=3085389235 TSecr=4205193836"
"36","11.771726453","10.0.0.1","10.0.0.6","TCP","70","43206  >  12345 [PSH, ACK] Seq=40 Ack=34 Win=83 Len=4 TSval=4205193836 TSecr=3085389235"
"37","11.771733037","10.0.0.6","10.0.0.1","TCP","66","12345  >  43206 [ACK] Seq=34 Ack=44 Win=85 Len=0 TSval=3085389235 TSecr=4205193836"
"38","11.771742250","10.0.0.1","10.0.0.6","TCP","67","43206  >  12345 [PSH, ACK] Seq=44 Ack=34 Win=83 Len=1 TSval=4205193836 TSecr=3085389235"
"39","11.771746917","10.0.0.6","10.0.0.1","TCP","66","12345  >  43206 [ACK] Seq=34 Ack=45 Win=85 Len=0 TSval=3085389235 TSecr=4205193836"
"40","11.771754411","10.0.0.1","10.0.0.6","TCP","92","43206  >  12345 [PSH, ACK] Seq=45 Ack=34 Win=83 Len=26 TSval=4205193836 TSecr=3085389235"
"41","11.771758962","10.0.0.6","10.0.0.1","TCP","66","12345  >  43206 [ACK] Seq=34 Ack=71 Win=85 Len=0 TSval=3085389235 TSecr=4205193836"
"42","11.772009215","10.0.0.6","10.0.0.2","TCP","70","12345  >  51128 [PSH, ACK] Seq=36 Ack=34 Win=85 Len=4 TSval=2581319460 TSecr=4177306908"
"43","11.772032123","10.0.0.2","10.0.0.6","TCP","66","51128  >  12345 [ACK] Seq=34 Ack=40 Win=83 Len=0 TSval=4177309118 TSecr=2581319460"
"44","11.772047215","10.0.0.6","10.0.0.2","TCP","70","12345  >  51128 [PSH, ACK] Seq=40 Ack=34 Win=85 Len=4 TSval=2581319460 TSecr=4177309118"
"45","11.772053215","10.0.0.2","10.0.0.6","TCP","66","51128  >  12345 [ACK] Seq=34 Ack=44 Win=83 Len=0 TSval=4177309118 TSecr=2581319460"
"46","11.772061745","10.0.0.6","10.0.0.2","TCP","67","12345  >  51128 [PSH, ACK] Seq=44 Ack=34 Win=85 Len=1 TSval=2581319460 TSecr=4177309118"
"47","11.772066400","10.0.0.2","10.0.0.6","TCP","66","51128  >  12345 [ACK] Seq=34 Ack=45 Win=83 Len=0 TSval=4177309118 TSecr=2581319460"
"48","11.772073701","10.0.0.6","10.0.0.2","TCP","92","12345  >  51128 [PSH, ACK] Seq=45 Ack=34 Win=85 Len=26 TSval=2581319460 TSecr=4177309118"
"49","11.772078235","10.0.0.2","10.0.0.6","TCP","66","51128  >  12345 [ACK] Seq=34 Ack=71 Win=83 Len=0 TSval=4177309118 TSecr=2581319460"
"50","13.976814407","10.0.0.2","10.0.0.6","TCP","70","51128  >  12345 [PSH, ACK] Seq=34 Ack=71 Win=83 Len=4 TSval=4177311322 TSecr=2581319460"
"51","13.976839540","10.0.0.6","10.0.0.2","TCP","66","12345  >  51128 [ACK] Seq=71 Ack=38 Win=85 Len=0 TSval=2581321664 TSecr=4177311322"
"52","13.976859025","10.0.0.2","10.0.0.6","TCP","70","51128  >  12345 [PSH, ACK] Seq=38 Ack=71 Win=83 Len=4 TSval=4177311322 TSecr=2581321664"
"53","13.976865071","10.0.0.6","10.0.0.2","TCP","66","12345  >  51128 [ACK] Seq=71 Ack=42 Win=85 Len=0 TSval=2581321664 TSecr=4177311322"
"54","13.976874367","10.0.0.2","10.0.0.6","TCP","67","51128  >  12345 [PSH, ACK] Seq=42 Ack=71 Win=83 Len=1 TSval=4177311322 TSecr=2581321664"
"55","13.976878996","10.0.0.6","10.0.0.2","TCP","66","12345  >  51128 [ACK] Seq=71 Ack=43 Win=85 Len=0 TSval=2581321664 TSecr=4177311322"
"56","13.976887200","10.0.0.2","10.0.0.6","TCP","90","51128  >  12345 [PSH, ACK] Seq=43 Ack=71 Win=83 Len=24 TSval=4177311322 TSecr=2581321664"
"57","13.976891687","10.0.0.6","10.0.0.2","TCP","66","12345  >  51128 [ACK] Seq=71 Ack=67 Win=85 Len=0 TSval=2581321664 TSecr=4177311322"
"58","13.977146368","10.0.0.6","10.0.0.1","TCP","70","12345  >  43206 [PSH, ACK] Seq=34 Ack=71 Win=85 Len=4 TSval=3085391441 TSecr=4205193836"
"59","13.977163690","10.0.0.1","10.0.0.6","TCP","66","43206  >  12345 [ACK] Seq=71 Ack=38 Win=83 Len=0 TSval=4205196042 TSecr=3085391441"
"60","13.977175889","10.0.0.6","10.0.0.1","TCP","70","12345  >  43206 [PSH, ACK] Seq=38 Ack=71 Win=85 Len=4 TSval=3085391441 TSecr=4205196042"
"61","13.977180976","10.0.0.1","10.0.0.6","TCP","66","43206  >  12345 [ACK] Seq=71 Ack=42 Win=83 Len=0 TSval=4205196042 TSecr=3085391441"
"62","13.977188254","10.0.0.6","10.0.0.1","TCP","67","12345  >  43206 [PSH, ACK] Seq=42 Ack=71 Win=85 Len=1 TSval=3085391441 TSecr=4205196042"
"63","13.977192461","10.0.0.1","10.0.0.6","TCP","66","43206  >  12345 [ACK] Seq=71 Ack=43 Win=83 Len=0 TSval=4205196042 TSecr=3085391441"
"64","13.977199426","10.0.0.6","10.0.0.1","TCP","90","12345  >  43206 [PSH, ACK] Seq=43 Ack=71 Win=85 Len=24 TSval=3085391441 TSecr=4205196042"
"65","13.977203418","10.0.0.1","10.0.0.6","TCP","66","43206  >  12345 [ACK] Seq=71 Ack=67 Win=83 Len=0 TSval=4205196042 TSecr=3085391441"
"66","16.185015929","10.0.0.1","10.0.0.6","TCP","70","43206  >  12345 [PSH, ACK] Seq=71 Ack=67 Win=83 Len=4 TSval=4205198250 TSecr=3085391441"
"67","16.185041371","10.0.0.6","10.0.0.1","TCP","66","12345  >  43206 [ACK] Seq=67 Ack=75 Win=85 Len=0 TSval=3085393649 TSecr=4205198250"
"68","16.185059440","10.0.0.1","10.0.0.6","TCP","70","43206  >  12345 [PSH, ACK] Seq=75 Ack=67 Win=83 Len=4 TSval=4205198250 TSecr=3085393649"
"69","16.185065364","10.0.0.6","10.0.0.1","TCP","66","12345  >  43206 [ACK] Seq=67 Ack=79 Win=85 Len=0 TSval=3085393649 TSecr=4205198250"
"70","16.185073885","10.0.0.1","10.0.0.6","TCP","67","43206  >  12345 [PSH, ACK] Seq=79 Ack=67 Win=83 Len=1 TSval=4205198250 TSecr=3085393649"
"71","16.185078030","10.0.0.6","10.0.0.1","TCP","66","12345  >  43206 [ACK] Seq=67 Ack=80 Win=85 Len=0 TSval=3085393649 TSecr=4205198250"
"72","16.185085313","10.0.0.1","10.0.0.6","TCP","92","43206  >  12345 [PSH, ACK] Seq=80 Ack=67 Win=83 Len=26 TSval=4205198250 TSecr=3085393649"
"73","16.185089277","10.0.0.6","10.0.0.1","TCP","66","12345  >  43206 [ACK] Seq=67 Ack=106 Win=85 Len=0 TSval=3085393649 TSecr=4205198250"
"74","16.189259209","10.0.0.6","10.0.0.2","TCP","70","12345  >  51128 [PSH, ACK] Seq=71 Ack=67 Win=85 Len=4 TSval=2581323877 TSecr=4177311322"
"75","16.189290626","10.0.0.2","10.0.0.6","TCP","66","51128  >  12345 [ACK] Seq=67 Ack=75 Win=83 Len=0 TSval=4177313535 TSecr=2581323877"
"76","16.189307705","10.0.0.6","10.0.0.2","TCP","70","12345  >  51128 [PSH, ACK] Seq=75 Ack=67 Win=85 Len=4 TSval=2581323877 TSecr=4177313535"
"77","16.189314314","10.0.0.2","10.0.0.6","TCP","66","51128  >  12345 [ACK] Seq=67 Ack=79 Win=83 Len=0 TSval=4177313535 TSecr=2581323877"
"78","16.189322921","10.0.0.6","10.0.0.2","TCP","67","12345  >  51128 [PSH, ACK] Seq=79 Ack=67 Win=85 Len=1 TSval=2581323877 TSecr=4177313535"
"79","16.189327341","10.0.0.2","10.0.0.6","TCP","66","51128  >  12345 [ACK] Seq=67 Ack=80 Win=83 Len=0 TSval=4177313535 TSecr=2581323877"
"80","16.189337702","10.0.0.6","10.0.0.2","TCP","92","12345  >  51128 [PSH, ACK] Seq=80 Ack=67 Win=85 Len=26 TSval=2581323877 TSecr=4177313535"
"81","16.189342474","10.0.0.2","10.0.0.6","TCP","66","51128  >  12345 [ACK] Seq=67 Ack=106 Win=83 Len=0 TSval=4177313535 TSecr=2581323877"
"82","18.389905439","10.0.0.2","10.0.0.6","TCP","70","51128  >  12345 [PSH, ACK] Seq=67 Ack=106 Win=83 Len=4 TSval=4177315735 TSecr=2581323877"
"83","18.389932027","10.0.0.6","10.0.0.2","TCP","66","12345  >  51128 [ACK] Seq=106 Ack=71 Win=85 Len=0 TSval=2581326077 TSecr=4177315735"
"84","18.389951316","10.0.0.2","10.0.0.6","TCP","70","51128  >  12345 [PSH, ACK] Seq=71 Ack=106 Win=83 Len=4 TSval=4177315735 TSecr=2581326077"
"85","18.389957574","10.0.0.6","10.0.0.2","TCP","66","12345  >  51128 [ACK] Seq=106 Ack=75 Win=85 Len=0 TSval=2581326077 TSecr=4177315735"
"86","18.389966694","10.0.0.2","10.0.0.6","TCP","67","51128  >  12345 [PSH, ACK] Seq=75 Ack=106 Win=83 Len=1 TSval=4177315735 TSecr=2581326077"
"87","18.389971006","10.0.0.6","10.0.0.2","TCP","66","12345  >  51128 [ACK] Seq=106 Ack=76 Win=85 Len=0 TSval=2581326077 TSecr=4177315735"
"88","18.389978683","10.0.0.2","10.0.0.6","TCP","90","51128  >  12345 [PSH, ACK] Seq=76 Ack=106 Win=83 Len=24 TSval=4177315735 TSecr=2581326077"
"89","18.389982822","10.0.0.6","10.0.0.2","TCP","66","12345  >  51128 [ACK] Seq=106 Ack=100 Win=85 Len=0 TSval=2581326077 TSecr=4177315735"
"90","18.390434979","10.0.0.6","10.0.0.1","TCP","70","12345  >  43206 [PSH, ACK] Seq=67 Ack=106 Win=85 Len=4 TSval=3085395854 TSecr=4205198250"
"91","18.390453421","10.0.0.1","10.0.0.6","TCP","66","43206  >  12345 [ACK] Seq=106 Ack=71 Win=83 Len=0 TSval=4205200455 TSecr=3085395854"
"92","18.390471395","10.0.0.6","10.0.0.1","TCP","70","12345  >  43206 [PSH, ACK] Seq=71 Ack=106 Win=85 Len=4 TSval=3085395854 TSecr=4205200455"
"93","18.390476795","10.0.0.1","10.0.0.6","TCP","66","43206  >  12345 [ACK] Seq=106 Ack=75 Win=83 Len=0 TSval=4205200455 TSecr=3085395854"
"94","18.390484498","10.0.0.6","10.0.0.1","TCP","67","12345  >  43206 [PSH, ACK] Seq=75 Ack=106 Win=85 Len=1 TSval=3085395854 TSecr=4205200455"
"95","18.390488990","10.0.0.1","10.0.0.6","TCP","66","43206  >  12345 [ACK] Seq=106 Ack=76 Win=83 Len=0 TSval=4205200455 TSecr=3085395854"
"96","18.390495477","10.0.0.6","10.0.0.1","TCP","90","12345  >  43206 [PSH, ACK] Seq=76 Ack=106 Win=85 Len=24 TSval=3085395854 TSecr=4205200455"
"97","18.390499970","10.0.0.1","10.0.0.6","TCP","66","43206  >  12345 [ACK] Seq=106 Ack=100 Win=83 Len=0 TSval=4205200455 TSecr=3085395854"
"98","20.594516280","10.0.0.1","10.0.0.6","TCP","70","43206  >  12345 [PSH, ACK] Seq=106 Ack=100 Win=83 Len=4 TSval=4205202659 TSecr=3085395854"
"99","20.594542013","10.0.0.6","10.0.0.1","TCP","66","12345  >  43206 [ACK] Seq=100 Ack=110 Win=85 Len=0 TSval=3085398058 TSecr=4205202659"
"100","20.594574750","10.0.0.1","10.0.0.6","TCP","70","43206  >  12345 [PSH, ACK] Seq=110 Ack=100 Win=83 Len=4 TSval=4205202659 TSecr=3085398058"
"101","20.594584170","10.0.0.1","10.0.0.6","TCP","67","43206  >  12345 [PSH, ACK] Seq=114 Ack=100 Win=83 Len=1 TSval=4205202659 TSecr=3085398058"
"102","20.594591427","10.0.0.1","10.0.0.6","TCP","92","43206  >  12345 [PSH, ACK] Seq=115 Ack=100 Win=83 Len=26 TSval=4205202659 TSecr=3085398058"
"103","20.594591989","10.0.0.6","10.0.0.1","TCP","66","12345  >  43206 [ACK] Seq=100 Ack=114 Win=85 Len=0 TSval=3085398058 TSecr=4205202659"
"104","20.594607194","10.0.0.6","10.0.0.1","TCP","66","12345  >  43206 [ACK] Seq=100 Ack=115 Win=85 Len=0 TSval=3085398058 TSecr=4205202659"
"105","20.594614118","10.0.0.6","10.0.0.1","TCP","66","12345  >  43206 [ACK] Seq=100 Ack=141 Win=85 Len=0 TSval=3085398058 TSecr=4205202659"
"106","20.597711951","10.0.0.6","10.0.0.2","TCP","70","12345  >  51128 [PSH, ACK] Seq=106 Ack=100 Win=85 Len=4 TSval=2581328285 TSecr=4177315735"
"107","20.597734571","10.0.0.2","10.0.0.6","TCP","66","51128  >  12345 [ACK] Seq=100 Ack=110 Win=83 Len=0 TSval=4177317943 TSecr=2581328285"
"108","20.597748507","10.0.0.6","10.0.0.2","TCP","70","12345  >  51128 [PSH, ACK] Seq=110 Ack=100 Win=85 Len=4 TSval=2581328285 TSecr=4177317943"
"109","20.597754824","10.0.0.2","10.0.0.6","TCP","66","51128  >  12345 [ACK] Seq=100 Ack=114 Win=83 Len=0 TSval=4177317943 TSecr=2581328285"
"110","20.597762782","10.0.0.6","10.0.0.2","TCP","67","12345  >  51128 [PSH, ACK] Seq=114 Ack=100 Win=85 Len=1 TSval=2581328285 TSecr=4177317943"
"111","20.597767176","10.0.0.2","10.0.0.6","TCP","66","51128  >  12345 [ACK] Seq=100 Ack=115 Win=83 Len=0 TSval=4177317943 TSecr=2581328285"
"112","20.597773947","10.0.0.6","10.0.0.2","TCP","92","12345  >  51128 [PSH, ACK] Seq=115 Ack=100 Win=85 Len=26 TSval=2581328285 TSecr=4177317943"
"113","20.597778248","10.0.0.2","10.0.0.6","TCP","66","51128  >  12345 [ACK] Seq=100 Ack=141 Win=83 Len=0 TSval=4177317943 TSecr=2581328285"
"114","22.799504523","10.0.0.2","10.0.0.6","TCP","70","51128  >  12345 [PSH, ACK] Seq=100 Ack=141 Win=83 Len=4 TSval=4177320145 TSecr=2581328285"
"115","22.799532723","10.0.0.6","10.0.0.2","TCP","66","12345  >  51128 [ACK] Seq=141 Ack=104 Win=85 Len=0 TSval=2581330487 TSecr=4177320145"
"116","22.799565250","10.0.0.2","10.0.0.6","TCP","70","51128  >  12345 [PSH, ACK] Seq=104 Ack=141 Win=83 Len=4 TSval=4177320145 TSecr=2581330487"
"117","22.799577205","10.0.0.6","10.0.0.2","TCP","66","12345  >  51128 [ACK] Seq=141 Ack=108 Win=85 Len=0 TSval=2581330487 TSecr=4177320145"
"118","22.799588474","10.0.0.2","10.0.0.6","TCP","67","51128  >  12345 [PSH, ACK] Seq=108 Ack=141 Win=83 Len=1 TSval=4177320145 TSecr=2581330487"
"119","22.799598379","10.0.0.6","10.0.0.2","TCP","66","12345  >  51128 [ACK] Seq=141 Ack=109 Win=85 Len=0 TSval=2581330487 TSecr=4177320145"
"120","22.799607285","10.0.0.2","10.0.0.6","TCP","90","51128  >  12345 [PSH, ACK] Seq=109 Ack=141 Win=83 Len=24 TSval=4177320145 TSecr=2581330487"
"121","22.799616887","10.0.0.6","10.0.0.2","TCP","66","12345  >  51128 [ACK] Seq=141 Ack=133 Win=85 Len=0 TSval=2581330487 TSecr=4177320145"
"122","22.799800001","10.0.0.6","10.0.0.1","TCP","70","12345  >  43206 [PSH, ACK] Seq=100 Ack=141 Win=85 Len=4 TSval=3085400263 TSecr=4205202659"
"123","22.799828225","10.0.0.1","10.0.0.6","TCP","66","43206  >  12345 [ACK] Seq=141 Ack=104 Win=83 Len=0 TSval=4205204864 TSecr=3085400263"
"124","22.799843239","10.0.0.6","10.0.0.1","TCP","70","12345  >  43206 [PSH, ACK] Seq=104 Ack=141 Win=85 Len=4 TSval=3085400263 TSecr=4205204864"
"125","22.799849646","10.0.0.1","10.0.0.6","TCP","66","43206  >  12345 [ACK] Seq=141 Ack=108 Win=83 Len=0 TSval=4205204864 TSecr=3085400263"
"126","22.799857879","10.0.0.6","10.0.0.1","TCP","67","12345  >  43206 [PSH, ACK] Seq=108 Ack=141 Win=85 Len=1 TSval=3085400263 TSecr=4205204864"
"127","22.799862188","10.0.0.1","10.0.0.6","TCP","66","43206  >  12345 [ACK] Seq=141 Ack=109 Win=83 Len=0 TSval=4205204864 TSecr=3085400263"
"128","22.799869246","10.0.0.6","10.0.0.1","TCP","90","12345  >  43206 [PSH, ACK] Seq=109 Ack=141 Win=85 Len=24 TSval=3085400263 TSecr=4205204864"
"129","22.799873384","10.0.0.1","10.0.0.6","TCP","66","43206  >  12345 [ACK] Seq=141 Ack=133 Win=83 Len=0 TSval=4205204864 TSecr=3085400263"
"130","25.007284118","10.0.0.1","10.0.0.6","TCP","70","43206  >  12345 [PSH, ACK] Seq=141 Ack=133 Win=83 Len=4 TSval=4205207072 TSecr=3085400263"
"131","25.007311014","10.0.0.6","10.0.0.1","TCP","66","12345  >  43206 [ACK] Seq=133 Ack=145 Win=85 Len=0 TSval=3085402471 TSecr=4205207072"
"132","25.007329491","10.0.0.1","10.0.0.6","TCP","70","43206  >  12345 [PSH, ACK] Seq=145 Ack=133 Win=83 Len=4 TSval=4205207072 TSecr=3085402471"
"133","25.007335906","10.0.0.6","10.0.0.1","TCP","66","12345  >  43206 [ACK] Seq=133 Ack=149 Win=85 Len=0 TSval=3085402471 TSecr=4205207072"
"134","25.007345163","10.0.0.1","10.0.0.6","TCP","67","43206  >  12345 [PSH, ACK] Seq=149 Ack=133 Win=83 Len=1 TSval=4205207072 TSecr=3085402471"
"135","25.007349432","10.0.0.6","10.0.0.1","TCP","66","12345  >  43206 [ACK] Seq=133 Ack=150 Win=85 Len=0 TSval=3085402471 TSecr=4205207072"
"136","25.007356456","10.0.0.1","10.0.0.6","TCP","92","43206  >  12345 [PSH, ACK] Seq=150 Ack=133 Win=83 Len=26 TSval=4205207072 TSecr=3085402471"
"137","25.007360475","10.0.0.6","10.0.0.1","TCP","66","12345  >  43206 [ACK] Seq=133 Ack=176 Win=85 Len=0 TSval=3085402471 TSecr=4205207072"
"138","25.010449418","10.0.0.6","10.0.0.2","TCP","70","12345  >  51128 [PSH, ACK] Seq=141 Ack=133 Win=85 Len=4 TSval=2581332698 TSecr=4177320145"
"139","25.010479134","10.0.0.2","10.0.0.6","TCP","66","51128  >  12345 [ACK] Seq=133 Ack=145 Win=83 Len=0 TSval=4177322356 TSecr=2581332698"
"140","25.010494815","10.0.0.6","10.0.0.2","TCP","70","12345  >  51128 [PSH, ACK] Seq=145 Ack=133 Win=85 Len=4 TSval=2581332698 TSecr=4177322356"
"141","25.010501095","10.0.0.2","10.0.0.6","TCP","66","51128  >  12345 [ACK] Seq=133 Ack=149 Win=83 Len=0 TSval=4177322356 TSecr=2581332698"
"142","25.010509277","10.0.0.6","10.0.0.2","TCP","67","12345  >  51128 [PSH, ACK] Seq=149 Ack=133 Win=85 Len=1 TSval=2581332698 TSecr=4177322356"
"143","25.010513854","10.0.0.2","10.0.0.6","TCP","66","51128  >  12345 [ACK] Seq=133 Ack=150 Win=83 Len=0 TSval=4177322356 TSecr=2581332698"
"144","25.010520869","10.0.0.6","10.0.0.2","TCP","92","12345  >  51128 [PSH, ACK] Seq=150 Ack=133 Win=85 Len=26 TSval=2581332698 TSecr=4177322356"
"145","25.010525459","10.0.0.2","10.0.0.6","TCP","66","51128  >  12345 [ACK] Seq=133 Ack=176 Win=83 Len=0 TSval=4177322356 TSecr=2581332698"
"146","27.219856496","10.0.0.2","10.0.0.6","TCP","70","51128  >  12345 [PSH, ACK] Seq=133 Ack=176 Win=83 Len=4 TSval=4177324565 TSecr=2581332698"
"147","27.219879726","10.0.0.6","10.0.0.2","TCP","66","12345  >  51128 [ACK] Seq=176 Ack=137 Win=85 Len=0 TSval=2581334907 TSecr=4177324565"
"148","27.219897755","10.0.0.2","10.0.0.6","TCP","70","51128  >  12345 [PSH, ACK] Seq=137 Ack=176 Win=83 Len=4 TSval=4177324565 TSecr=2581334907"
"149","27.219903765","10.0.0.6","10.0.0.2","TCP","66","12345  >  51128 [ACK] Seq=176 Ack=141 Win=85 Len=0 TSval=2581334907 TSecr=4177324565"
"150","27.219912456","10.0.0.2","10.0.0.6","TCP","67","51128  >  12345 [PSH, ACK] Seq=141 Ack=176 Win=83 Len=1 TSval=4177324565 TSecr=2581334907"
"151","27.219916674","10.0.0.6","10.0.0.2","TCP","66","12345  >  51128 [ACK] Seq=176 Ack=142 Win=85 Len=0 TSval=2581334907 TSecr=4177324565"
"152","27.219924224","10.0.0.2","10.0.0.6","TCP","90","51128  >  12345 [PSH, ACK] Seq=142 Ack=176 Win=83 Len=24 TSval=4177324565 TSecr=2581334907"
"153","27.219928203","10.0.0.6","10.0.0.2","TCP","66","12345  >  51128 [ACK] Seq=176 Ack=166 Win=85 Len=0 TSval=2581334907 TSecr=4177324565"
"154","27.220153530","10.0.0.6","10.0.0.1","TCP","70","12345  >  43206 [PSH, ACK] Seq=133 Ack=176 Win=85 Len=4 TSval=3085404684 TSecr=4205207072"
"155","27.220174858","10.0.0.1","10.0.0.6","TCP","66","43206  >  12345 [ACK] Seq=176 Ack=137 Win=83 Len=0 TSval=4205209285 TSecr=3085404684"
"156","27.220190175","10.0.0.6","10.0.0.1","TCP","70","12345  >  43206 [PSH, ACK] Seq=137 Ack=176 Win=85 Len=4 TSval=3085404684 TSecr=4205209285"
"157","27.220196674","10.0.0.1","10.0.0.6","TCP","66","43206  >  12345 [ACK] Seq=176 Ack=141 Win=83 Len=0 TSval=4205209285 TSecr=3085404684"
"158","27.220205282","10.0.0.6","10.0.0.1","TCP","67","12345  >  43206 [PSH, ACK] Seq=141 Ack=176 Win=85 Len=1 TSval=3085404684 TSecr=4205209285"
"159","27.220209925","10.0.0.1","10.0.0.6","TCP","66","43206  >  12345 [ACK] Seq=176 Ack=142 Win=83 Len=0 TSval=4205209285 TSecr=3085404684"
"160","27.220216849","10.0.0.6","10.0.0.1","TCP","90","12345  >  43206 [PSH, ACK] Seq=142 Ack=176 Win=85 Len=24 TSval=3085404684 TSecr=4205209285"
"161","27.220221222","10.0.0.1","10.0.0.6","TCP","66","43206  >  12345 [ACK] Seq=176 Ack=166 Win=83 Len=0 TSval=4205209285 TSecr=3085404684"
"162","29.426006638","10.0.0.1","10.0.0.6","TCP","70","43206  >  12345 [PSH, ACK] Seq=176 Ack=166 Win=83 Len=4 TSval=4205211490 TSecr=3085404684"
"163","29.426031859","10.0.0.6","10.0.0.1","TCP","66","12345  >  43206 [ACK] Seq=166 Ack=180 Win=85 Len=0 TSval=3085406890 TSecr=4205211490"
"164","29.426050992","10.0.0.1","10.0.0.6","TCP","70","43206  >  12345 [PSH, ACK] Seq=180 Ack=166 Win=83 Len=4 TSval=4205211491 TSecr=3085406890"
"165","29.426057611","10.0.0.6","10.0.0.1","TCP","66","12345  >  43206 [ACK] Seq=166 Ack=184 Win=85 Len=0 TSval=3085406890 TSecr=4205211491"
"166","29.426066227","10.0.0.1","10.0.0.6","TCP","67","43206  >  12345 [PSH, ACK] Seq=184 Ack=166 Win=83 Len=1 TSval=4205211491 TSecr=3085406890"
"167","29.426070385","10.0.0.6","10.0.0.1","TCP","66","12345  >  43206 [ACK] Seq=166 Ack=185 Win=85 Len=0 TSval=3085406890 TSecr=4205211491"
"168","29.426077541","10.0.0.1","10.0.0.6","TCP","92","43206  >  12345 [PSH, ACK] Seq=185 Ack=166 Win=83 Len=26 TSval=4205211491 TSecr=3085406890"
"169","29.426081651","10.0.0.6","10.0.0.1","TCP","66","12345  >  43206 [ACK] Seq=166 Ack=211 Win=85 Len=0 TSval=3085406890 TSecr=4205211491"
"170","29.426320062","10.0.0.6","10.0.0.2","TCP","70","12345  >  51128 [PSH, ACK] Seq=176 Ack=166 Win=85 Len=4 TSval=2581337114 TSecr=4177324565"
"171","29.426337013","10.0.0.2","10.0.0.6","TCP","66","51128  >  12345 [ACK] Seq=166 Ack=180 Win=83 Len=0 TSval=4177326772 TSecr=2581337114"
"172","29.426348490","10.0.0.6","10.0.0.2","TCP","70","12345  >  51128 [PSH, ACK] Seq=180 Ack=166 Win=85 Len=4 TSval=2581337114 TSecr=4177326772"
"173","29.426353686","10.0.0.2","10.0.0.6","TCP","66","51128  >  12345 [ACK] Seq=166 Ack=184 Win=83 Len=0 TSval=4177326772 TSecr=2581337114"
"174","29.426360934","10.0.0.6","10.0.0.2","TCP","67","12345  >  51128 [PSH, ACK] Seq=184 Ack=166 Win=85 Len=1 TSval=2581337114 TSecr=4177326772"
"175","29.426365203","10.0.0.2","10.0.0.6","TCP","66","51128  >  12345 [ACK] Seq=166 Ack=185 Win=83 Len=0 TSval=4177326772 TSecr=2581337114"
"176","29.426371883","10.0.0.6","10.0.0.2","TCP","92","12345  >  51128 [PSH, ACK] Seq=185 Ack=166 Win=85 Len=26 TSval=2581337114 TSecr=4177326772"
"177","29.426376167","10.0.0.2","10.0.0.6","TCP","66","51128  >  12345 [ACK] Seq=166 Ack=211 Win=83 Len=0 TSval=4177326772 TSecr=2581337114"
"178","30.463823844","fe80::8098:3eff:feb4:c94a","ff02::2","ICMPv6","70","Router Solicitation from 82:98:3e:b4:c9:4a"
"179","30.463832024","fe80::a06e:94ff:fe3c:9f1b","ff02::2","ICMPv6","70","Router Solicitation from a2:6e:94:3c:9f:1b"
"180","30.464101803","fe80::2cea:cfff:fee0:9950","ff02::2","ICMPv6","70","Router Solicitation from 2e:ea:cf:e0:99:50"
"181","31.637338455","10.0.0.2","10.0.0.6","TCP","70","51128  >  12345 [PSH, ACK] Seq=166 Ack=211 Win=83 Len=4 TSval=4177328983 TSecr=2581337114"
"182","31.637363732","10.0.0.6","10.0.0.2","TCP","66","12345  >  51128 [ACK] Seq=211 Ack=170 Win=85 Len=0 TSval=2581339325 TSecr=4177328983"
"183","31.637382717","10.0.0.2","10.0.0.6","TCP","70","51128  >  12345 [PSH, ACK] Seq=170 Ack=211 Win=83 Len=4 TSval=4177328983 TSecr=2581339325"
"184","31.637389307","10.0.0.6","10.0.0.2","TCP","66","12345  >  51128 [ACK] Seq=211 Ack=174 Win=85 Len=0 TSval=2581339325 TSecr=4177328983"
"185","31.637398229","10.0.0.2","10.0.0.6","TCP","67","51128  >  12345 [PSH, ACK] Seq=174 Ack=211 Win=83 Len=1 TSval=4177328983 TSecr=2581339325"
"186","31.637402462","10.0.0.6","10.0.0.2","TCP","66","12345  >  51128 [ACK] Seq=211 Ack=175 Win=85 Len=0 TSval=2581339325 TSecr=4177328983"
"187","31.637409731","10.0.0.2","10.0.0.6","TCP","90","51128  >  12345 [PSH, ACK] Seq=175 Ack=211 Win=83 Len=24 TSval=4177328983 TSecr=2581339325"
"188","31.637413855","10.0.0.6","10.0.0.2","TCP","66","12345  >  51128 [ACK] Seq=211 Ack=199 Win=85 Len=0 TSval=2581339325 TSecr=4177328983"
"189","31.638187169","10.0.0.6","10.0.0.1","TCP","70","12345  >  43206 [PSH, ACK] Seq=166 Ack=211 Win=85 Len=4 TSval=3085409102 TSecr=4205211491"
"190","31.638204976","10.0.0.1","10.0.0.6","TCP","66","43206  >  12345 [ACK] Seq=211 Ack=170 Win=83 Len=0 TSval=4205213703 TSecr=3085409102"
"191","31.638217340","10.0.0.6","10.0.0.1","TCP","70","12345  >  43206 [PSH, ACK] Seq=170 Ack=211 Win=85 Len=4 TSval=3085409102 TSecr=4205213703"
"192","31.638222619","10.0.0.1","10.0.0.6","TCP","66","43206  >  12345 [ACK] Seq=211 Ack=174 Win=83 Len=0 TSval=4205213703 TSecr=3085409102"
"193","31.638229974","10.0.0.6","10.0.0.1","TCP","67","12345  >  43206 [PSH, ACK] Seq=174 Ack=211 Win=85 Len=1 TSval=3085409102 TSecr=4205213703"
"194","31.638234149","10.0.0.1","10.0.0.6","TCP","66","43206  >  12345 [ACK] Seq=211 Ack=175 Win=83 Len=0 TSval=4205213703 TSecr=3085409102"
"195","31.638240680","10.0.0.6","10.0.0.1","TCP","90","12345  >  43206 [PSH, ACK] Seq=175 Ack=211 Win=85 Len=24 TSval=3085409102 TSecr=4205213703"
"196","31.638244670","10.0.0.1","10.0.0.6","TCP","66","43206  >  12345 [ACK] Seq=211 Ack=199 Win=83 Len=0 TSval=4205213703 TSecr=3085409102"
"197","32.512081298","fe80::3c03:74ff:feb8:e498","ff02::2","ICMPv6","70","Router Solicitation from 3e:03:74:b8:e4:98"
"198","33.846193580","10.0.0.1","10.0.0.6","TCP","70","43206  >  12345 [PSH, ACK] Seq=211 Ack=199 Win=83 Len=4 TSval=4205215911 TSecr=3085409102"
"199","33.846217457","10.0.0.6","10.0.0.1","TCP","66","12345  >  43206 [ACK] Seq=199 Ack=215 Win=85 Len=0 TSval=3085411310 TSecr=4205215911"
"200","33.846236508","10.0.0.1","10.0.0.6","TCP","70","43206  >  12345 [PSH, ACK] Seq=215 Ack=199 Win=83 Len=4 TSval=4205215911 TSecr=3085411310"
"201","33.846242865","10.0.0.6","10.0.0.1","TCP","66","12345  >  43206 [ACK] Seq=199 Ack=219 Win=85 Len=0 TSval=3085411310 TSecr=4205215911"
"202","33.846251833","10.0.0.1","10.0.0.6","TCP","67","43206  >  12345 [PSH, ACK] Seq=219 Ack=199 Win=83 Len=1 TSval=4205215911 TSecr=3085411310"
"203","33.846256251","10.0.0.6","10.0.0.1","TCP","66","12345  >  43206 [ACK] Seq=199 Ack=220 Win=85 Len=0 TSval=3085411310 TSecr=4205215911"
"204","33.846263435","10.0.0.1","10.0.0.6","TCP","92","43206  >  12345 [PSH, ACK] Seq=220 Ack=199 Win=83 Len=26 TSval=4205215911 TSecr=3085411310"
"205","33.846267352","10.0.0.6","10.0.0.1","TCP","66","12345  >  43206 [ACK] Seq=199 Ack=246 Win=85 Len=0 TSval=3085411310 TSecr=4205215911"
"206","33.847856370","10.0.0.6","10.0.0.2","TCP","70","12345  >  51128 [PSH, ACK] Seq=211 Ack=199 Win=85 Len=4 TSval=2581341535 TSecr=4177328983"
"207","33.847876904","10.0.0.2","10.0.0.6","TCP","66","51128  >  12345 [ACK] Seq=199 Ack=215 Win=83 Len=0 TSval=4177331193 TSecr=2581341535"
"208","33.847894925","10.0.0.6","10.0.0.2","TCP","70","12345  >  51128 [PSH, ACK] Seq=215 Ack=199 Win=85 Len=4 TSval=2581341535 TSecr=4177331193"
"209","33.847901124","10.0.0.2","10.0.0.6","TCP","66","51128  >  12345 [ACK] Seq=199 Ack=219 Win=83 Len=0 TSval=4177331193 TSecr=2581341535"
"210","33.847909134","10.0.0.6","10.0.0.2","TCP","67","12345  >  51128 [PSH, ACK] Seq=219 Ack=199 Win=85 Len=1 TSval=2581341535 TSecr=4177331193"
"211","33.847913674","10.0.0.2","10.0.0.6","TCP","66","51128  >  12345 [ACK] Seq=199 Ack=220 Win=83 Len=0 TSval=4177331193 TSecr=2581341535"
"212","33.847920264","10.0.0.6","10.0.0.2","TCP","92","12345  >  51128 [PSH, ACK] Seq=220 Ack=199 Win=85 Len=26 TSval=2581341535 TSecr=4177331193"
"213","33.847924497","10.0.0.2","10.0.0.6","TCP","66","51128  >  12345 [ACK] Seq=199 Ack=246 Win=83 Len=0 TSval=4177331193 TSecr=2581341535"
"214","33.936157013","10.0.0.3","10.0.0.6","TCP","554","1736  >  12345 [SYN] Seq=0 Win=512 Len=500"
"215","33.936252756","10.0.0.3","10.0.0.6","TCP","554","1737  >  12345 [SYN] Seq=0 Win=512 Len=500"
"216","33.936379698","10.0.0.6","10.0.0.3","TCP","58","12345  >  1736 [SYN, ACK] Seq=0 Ack=1 Win=42340 Len=0 MSS=1460"
"217","33.936451463","10.0.0.6","10.0.0.3","TCP","58","12345  >  1737 [SYN, ACK] Seq=0 Ack=1 Win=42340 Len=0 MSS=1460"
"218","33.936477925","10.0.0.3","10.0.0.6","TCP","54","1736  >  12345 [RST] Seq=1 Win=0 Len=0"
"219","33.936540964","10.0.0.3","10.0.0.6","TCP","54","1737  >  12345 [RST] Seq=1 Win=0 Len=0"
"220","34.271989179","10.0.0.3","10.0.0.6","TCP","554","50196  >  12345 [SYN] Seq=0 Win=512 Len=500"
"221","34.272017480","10.0.0.6","10.0.0.3","TCP","58","12345  >  50196 [SYN, ACK] Seq=0 Ack=1 Win=42340 Len=0 MSS=1460"
"222","34.352604169","10.0.0.5","10.0.0.6","TCP","554","1736  >  12345 [SYN] Seq=0 Win=512 Len=500"
"223","34.352746815","10.0.0.6","10.0.0.5","TCP","58","12345  >  1736 [SYN, ACK] Seq=0 Ack=1 Win=42340 Len=0 MSS=1460"
"224","34.352763980","10.0.0.5","10.0.0.6","TCP","554","1737  >  12345 [SYN] Seq=0 Win=512 Len=500"
"225","34.352785814","10.0.0.6","10.0.0.5","TCP","58","12345  >  1737 [SYN, ACK] Seq=0 Ack=1 Win=42340 Len=0 MSS=1460"
"226","34.352808787","10.0.0.5","10.0.0.6","TCP","54","1736  >  12345 [RST] Seq=1 Win=0 Len=0"
"227","34.352869655","10.0.0.5","10.0.0.6","TCP","54","1737  >  12345 [RST] Seq=1 Win=0 Len=0"
"228","34.688447204","10.0.0.5","10.0.0.6","TCP","554","34580  >  12345 [SYN] Seq=0 Win=512 Len=500"
"229","34.688480170","10.0.0.6","10.0.0.5","TCP","58","12345  >  34580 [SYN, ACK] Seq=0 Ack=1 Win=42340 Len=0 MSS=1460"
"230","34.703990442","10.0.0.3","10.0.0.6","TCP","554","46951  >  12345 [SYN] Seq=0 Win=512 Len=500"
"231","34.704019965","10.0.0.6","10.0.0.3","TCP","58","12345  >  46951 [SYN, ACK] Seq=0 Ack=1 Win=42340 Len=0 MSS=1460"
"232","34.769911672","10.0.0.4","10.0.0.6","TCP","554","1736  >  12345 [SYN] Seq=0 Win=512 Len=500"
"233","34.769924869","10.0.0.4","10.0.0.6","TCP","554","1737  >  12345 [SYN] Seq=0 Win=512 Len=500"
"234","34.770109432","10.0.0.6","10.0.0.4","TCP","58","12345  >  1736 [SYN, ACK] Seq=0 Ack=1 Win=42340 Len=0 MSS=1460"
"235","34.770119887","10.0.0.6","10.0.0.4","TCP","58","12345  >  1737 [SYN, ACK] Seq=0 Ack=1 Win=42340 Len=0 MSS=1460"
"236","34.770194658","10.0.0.4","10.0.0.6","TCP","54","1736  >  12345 [RST] Seq=1 Win=0 Len=0"
"237","34.770210806","10.0.0.4","10.0.0.6","TCP","54","1737  >  12345 [RST] Seq=1 Win=0 Len=0"
"238","35.113563258","10.0.0.4","10.0.0.6","TCP","554","28261  >  12345 [SYN] Seq=0 Win=512 Len=500"
"239","35.113594848","10.0.0.6","10.0.0.4","TCP","58","12345  >  28261 [SYN, ACK] Seq=0 Ack=1 Win=42340 Len=0 MSS=1460"
"240","35.120434923","10.0.0.5","10.0.0.6","TCP","554","4142  >  12345 [SYN] Seq=0 Win=512 Len=500"
"241","35.120456961","10.0.0.6","10.0.0.5","TCP","58","12345  >  4142 [SYN, ACK] Seq=0 Ack=1 Win=42340 Len=0 MSS=1460"
"242","35.135990445","10.0.0.3","10.0.0.6","TCP","554","18176  >  12345 [SYN] Seq=0 Win=512 Len=500"
"243","35.136021593","10.0.0.6","10.0.0.3","TCP","58","12345  >  18176 [SYN, ACK] Seq=0 Ack=1 Win=42340 Len=0 MSS=1460"
"244","35.295799086","10.0.0.6","10.0.0.3","TCP","58","[TCP Retransmission] 12345  >  50196 [SYN, ACK] Seq=0 Ack=1 Win=42340 Len=0 MSS=1460"
"245","35.295831814","10.0.0.3","10.0.0.6","TCP","54","50196  >  12345 [RST] Seq=1 Win=0 Len=0"
"246","35.537465811","10.0.0.4","10.0.0.6","TCP","554","49572  >  12345 [SYN] Seq=0 Win=512 Len=500"
"247","35.537503410","10.0.0.6","10.0.0.4","TCP","58","12345  >  49572 [SYN, ACK] Seq=0 Ack=1 Win=42340 Len=0 MSS=1460"
"248","35.552442814","10.0.0.5","10.0.0.6","TCP","554","44921  >  12345 [SYN] Seq=0 Win=512 Len=500"
"249","35.552480782","10.0.0.6","10.0.0.5","TCP","58","12345  >  44921 [SYN, ACK] Seq=0 Ack=1 Win=42340 Len=0 MSS=1460"
"250","35.600023120","10.0.0.3","10.0.0.6","TCP","554","63238  >  12345 [SYN] Seq=0 Win=512 Len=500"
"251","35.600060445","10.0.0.6","10.0.0.3","TCP","58","12345  >  63238 [SYN, ACK] Seq=0 Ack=1 Win=42340 Len=0 MSS=1460"
"252","35.711793344","10.0.0.6","10.0.0.3","TCP","58","[TCP Retransmission] 12345  >  46951 [SYN, ACK] Seq=0 Ack=1 Win=42340 Len=0 MSS=1460"
"253","35.711796575","10.0.0.6","10.0.0.5","TCP","58","[TCP Retransmission] 12345  >  34580 [SYN, ACK] Seq=0 Ack=1 Win=42340 Len=0 MSS=1460"
"254","35.711827780","10.0.0.3","10.0.0.6","TCP","54","46951  >  12345 [RST] Seq=1 Win=0 Len=0"
"255","35.711829991","10.0.0.5","10.0.0.6","TCP","54","34580  >  12345 [RST] Seq=1 Win=0 Len=0"
"256","35.969473630","10.0.0.4","10.0.0.6","TCP","554","18120  >  12345 [SYN] Seq=0 Win=512 Len=500"
"257","35.969512747","10.0.0.6","10.0.0.4","TCP","58","12345  >  18120 [SYN, ACK] Seq=0 Ack=1 Win=42340 Len=0 MSS=1460"
"258","36.016445974","10.0.0.5","10.0.0.6","TCP","554","9284  >  12345 [SYN] Seq=0 Win=512 Len=500"
"259","36.016480090","10.0.0.6","10.0.0.5","TCP","58","12345  >  9284 [SYN, ACK] Seq=0 Ack=1 Win=42340 Len=0 MSS=1460"
"260","36.063991764","10.0.0.3","10.0.0.6","TCP","554","31865  >  12345 [SYN] Seq=0 Win=512 Len=500"
"261","36.064029502","10.0.0.6","10.0.0.3","TCP","58","12345  >  31865 [SYN, ACK] Seq=0 Ack=1 Win=42340 Len=0 MSS=1460"
"262","36.127807057","10.0.0.6","10.0.0.5","TCP","58","[TCP Retransmission] 12345  >  4142 [SYN, ACK] Seq=0 Ack=1 Win=42340 Len=0 MSS=1460"
"263","36.127811834","10.0.0.6","10.0.0.4","TCP","58","[TCP Retransmission] 12345  >  28261 [SYN, ACK] Seq=0 Ack=1 Win=42340 Len=0 MSS=1460"
"264","36.127847468","10.0.0.5","10.0.0.6","TCP","54","4142  >  12345 [RST] Seq=1 Win=0 Len=0"
"265","36.127849387","10.0.0.4","10.0.0.6","TCP","54","28261  >  12345 [RST] Seq=1 Win=0 Len=0"
"266","36.141057070","10.0.0.2","10.0.0.6","TCP","70","51128  >  12345 [PSH, ACK] Seq=199 Ack=246 Win=83 Len=4 TSval=4177333487 TSecr=2581341535"
"267","36.141087178","10.0.0.6","10.0.0.2","TCP","66","12345  >  51128 [ACK] Seq=246 Ack=203 Win=85 Len=0 TSval=2581343829 TSecr=4177333487"
"268","36.141109246","10.0.0.2","10.0.0.6","TCP","70","51128  >  12345 [PSH, ACK] Seq=203 Ack=246 Win=83 Len=4 TSval=4177333487 TSecr=2581343829"
"269","36.141116151","10.0.0.6","10.0.0.2","TCP","66","12345  >  51128 [ACK] Seq=246 Ack=207 Win=85 Len=0 TSval=2581343829 TSecr=4177333487"
"270","36.141126537","10.0.0.2","10.0.0.6","TCP","67","51128  >  12345 [PSH, ACK] Seq=207 Ack=246 Win=83 Len=1 TSval=4177333487 TSecr=2581343829"
"271","36.141131569","10.0.0.6","10.0.0.2","TCP","66","12345  >  51128 [ACK] Seq=246 Ack=208 Win=85 Len=0 TSval=2581343829 TSecr=4177333487"
"272","36.141139992","10.0.0.2","10.0.0.6","TCP","90","51128  >  12345 [PSH, ACK] Seq=208 Ack=246 Win=83 Len=24 TSval=4177333487 TSecr=2581343829"
"273","36.141144454","10.0.0.6","10.0.0.2","TCP","66","12345  >  51128 [ACK] Seq=246 Ack=232 Win=85 Len=0 TSval=2581343829 TSecr=4177333487"
"274","36.145062357","10.0.0.6","10.0.0.1","TCP","70","12345  >  43206 [PSH, ACK] Seq=199 Ack=246 Win=85 Len=4 TSval=3085413609 TSecr=4205215911"
"275","36.145091438","10.0.0.1","10.0.0.6","TCP","66","43206  >  12345 [ACK] Seq=246 Ack=203 Win=83 Len=0 TSval=4205218210 TSecr=3085413609"
"276","36.145110359","10.0.0.6","10.0.0.1","TCP","70","12345  >  43206 [PSH, ACK] Seq=203 Ack=246 Win=85 Len=4 TSval=3085413609 TSecr=4205218210"
"277","36.145117056","10.0.0.1","10.0.0.6","TCP","66","43206  >  12345 [ACK] Seq=246 Ack=207 Win=83 Len=0 TSval=4205218210 TSecr=3085413609"
"278","36.145125816","10.0.0.6","10.0.0.1","TCP","67","12345  >  43206 [PSH, ACK] Seq=207 Ack=246 Win=85 Len=1 TSval=3085413609 TSecr=4205218210"
"279","36.145130773","10.0.0.1","10.0.0.6","TCP","66","43206  >  12345 [ACK] Seq=246 Ack=208 Win=83 Len=0 TSval=4205218210 TSecr=3085413609"
"280","36.145138382","10.0.0.6","10.0.0.1","TCP","90","12345  >  43206 [PSH, ACK] Seq=208 Ack=246 Win=85 Len=24 TSval=3085413609 TSecr=4205218210"
"281","36.145143017","10.0.0.1","10.0.0.6","TCP","66","43206  >  12345 [ACK] Seq=246 Ack=232 Win=83 Len=0 TSval=4205218210 TSecr=3085413609"
"282","36.159895420","10.0.0.6","10.0.0.3","TCP","58","[TCP Retransmission] 12345  >  18176 [SYN, ACK] Seq=0 Ack=1 Win=42340 Len=0 MSS=1460"
"283","36.159929710","10.0.0.3","10.0.0.6","TCP","54","18176  >  12345 [RST] Seq=1 Win=0 Len=0"
"284","36.433458263","10.0.0.4","10.0.0.6","TCP","554","3885  >  12345 [SYN] Seq=0 Win=512 Len=500"
"285","36.433499777","10.0.0.6","10.0.0.4","TCP","58","12345  >  3885 [SYN, ACK] Seq=0 Ack=1 Win=42340 Len=0 MSS=1460"
"286","36.488006064","10.0.0.5","10.0.0.6","TCP","554","39933  >  12345 [SYN] Seq=0 Win=512 Len=500"
"287","36.488047080","10.0.0.6","10.0.0.5","TCP","58","12345  >  39933 [SYN, ACK] Seq=0 Ack=1 Win=42340 Len=0 MSS=1460"
"288","36.527994233","10.0.0.3","10.0.0.6","TCP","554","5403  >  12345 [SYN] Seq=0 Win=512 Len=500"
"289","36.528032265","10.0.0.6","10.0.0.3","TCP","58","12345  >  5403 [SYN, ACK] Seq=0 Ack=1 Win=42340 Len=0 MSS=1460"
"290","36.543796888","10.0.0.6","10.0.0.4","TCP","58","[TCP Retransmission] 12345  >  49572 [SYN, ACK] Seq=0 Ack=1 Win=42340 Len=0 MSS=1460"
"291","36.543825284","10.0.0.4","10.0.0.6","TCP","54","49572  >  12345 [RST] Seq=1 Win=0 Len=0"
"292","36.580052137","10.0.0.6","10.0.0.5","TCP","58","[TCP Retransmission] 12345  >  44921 [SYN, ACK] Seq=0 Ack=1 Win=42340 Len=0 MSS=1460"
"293","36.580076373","10.0.0.5","10.0.0.6","TCP","54","44921  >  12345 [RST] Seq=1 Win=0 Len=0"
"294","36.607792225","10.0.0.6","10.0.0.3","TCP","58","[TCP Retransmission] 12345  >  63238 [SYN, ACK] Seq=0 Ack=1 Win=42340 Len=0 MSS=1460"
"295","36.607812392","10.0.0.3","10.0.0.6","TCP","54","63238  >  12345 [RST] Seq=1 Win=0 Len=0"
"296","36.607965991","fe80::c45b:2ff:feba:91ea","ff02::2","ICMPv6","70","Router Solicitation from c6:5b:02:ba:91:ea"
"297","36.897456829","10.0.0.4","10.0.0.6","TCP","554","49380  >  12345 [SYN] Seq=0 Win=512 Len=500"
