"No.","Time","Source","Destination","Protocol","Length","Info"
"1","14:46:58.155187759","fe80::3c03:74ff:feb8:e498","ff02::2","ICMPv6","70","Router Solicitation from 3e:03:74:b8:e4:98"
"2","14:46:58.411171562","fe80::2cea:cfff:fee0:9950","ff02::2","ICMPv6","70","Router Solicitation from 2e:ea:cf:e0:99:50"
"3","14:46:59.947334004","fe80::c45b:2ff:feba:91ea","ff02::2","ICMPv6","70","Router Solicitation from c6:5b:02:ba:91:ea"
"4","14:47:01.999228329","fe80::30d9:beff:fe11:9d54","ff02::2","ICMPv6","70","Router Solicitation from 32:d9:be:11:9d:54"
"5","14:47:01.999250612","fe80::2d:e7ff:fed3:8742","ff02::2","ICMPv6","70","Router Solicitation from 02:2d:e7:d3:87:42"
"6","14:47:01.999277164","fe80::386f:4dff:febd:45a7","ff02::2","ICMPv6","70","Router Solicitation from 3a:6f:4d:bd:45:a7"
"7","14:47:05.510942300","10.0.0.1","10.0.0.6","TCP","70","43206  >  12345 [PSH, ACK] Seq=1 Ack=1 Win=83 Len=4 TSval=4205189420 TSecr=3085372909"
"8","14:47:05.510973457","10.0.0.1","10.0.0.6","TCP","70","43206  >  12345 [PSH, ACK] Seq=5 Ack=1 Win=83 Len=4 TSval=4205189420 TSecr=3085372909"
"9","14:47:05.510975737","10.0.0.1","10.0.0.6","TCP","67","43206  >  12345 [PSH, ACK] Seq=9 Ack=1 Win=83 Len=1 TSval=4205189420 TSecr=3085372909"
"10","14:47:05.510977510","10.0.0.1","10.0.0.6","TCP","92","43206  >  12345 [PSH, ACK] Seq=10 Ack=1 Win=83 Len=26 TSval=4205189420 TSecr=3085372909"
"11","14:47:05.511195780","10.0.0.6","10.0.0.1","TCP","66","12345  >  43206 [ACK] Seq=1 Ack=5 Win=85 Len=0 TSval=3085384819 TSecr=4205189420"
"12","14:47:05.511203993","10.0.0.6","10.0.0.1","TCP","66","12345  >  43206 [ACK] Seq=1 Ack=9 Win=85 Len=0 TSval=3085384819 TSecr=4205189420"
"13","14:47:05.511208337","10.0.0.6","10.0.0.1","TCP","66","12345  >  43206 [ACK] Seq=1 Ack=36 Win=85 Len=0 TSval=3085384819 TSecr=4205189420"
"14","14:47:05.511736954","10.0.0.6","10.0.0.2","TCP","70","12345  >  51128 [PSH, ACK] Seq=1 Ack=1 Win=85 Len=4 TSval=2581315044 TSecr=4177292791"
"15","14:47:05.511863748","10.0.0.2","10.0.0.6","TCP","66","51128  >  12345 [ACK] Seq=1 Ack=5 Win=83 Len=0 TSval=4177304702 TSecr=2581315044"
"16","14:47:05.511924578","10.0.0.6","10.0.0.2","TCP","97","12345  >  51128 [PSH, ACK] Seq=5 Ack=1 Win=85 Len=31 TSval=2581315044 TSecr=4177304702"
"17","14:47:05.511932240","10.0.0.2","10.0.0.6","TCP","66","51128  >  12345 [ACK] Seq=1 Ack=36 Win=83 Len=0 TSval=4177304702 TSecr=2581315044"
"18","14:47:07.718050718","10.0.0.2","10.0.0.6","TCP","70","51128  >  12345 [PSH, ACK] Seq=1 Ack=36 Win=83 Len=4 TSval=4177306908 TSecr=2581315044"
"19","14:47:07.718086010","10.0.0.6","10.0.0.2","TCP","66","12345  >  51128 [ACK] Seq=36 Ack=5 Win=85 Len=0 TSval=2581317250 TSecr=4177306908"
"20","14:47:07.718116547","10.0.0.2","10.0.0.6","TCP","70","51128  >  12345 [PSH, ACK] Seq=5 Ack=36 Win=83 Len=4 TSval=4177306908 TSecr=2581317250"
"21","14:47:07.718122437","10.0.0.6","10.0.0.2","TCP","66","12345  >  51128 [ACK] Seq=36 Ack=9 Win=85 Len=0 TSval=2581317250 TSecr=4177306908"
"22","14:47:07.718132662","10.0.0.2","10.0.0.6","TCP","67","51128  >  12345 [PSH, ACK] Seq=9 Ack=36 Win=83 Len=1 TSval=4177306908 TSecr=2581317250"
"23","14:47:07.718144156","10.0.0.6","10.0.0.2","TCP","66","12345  >  51128 [ACK] Seq=36 Ack=10 Win=85 Len=0 TSval=2581317250 TSecr=4177306908"
"24","14:47:07.718153509","10.0.0.2","10.0.0.6","TCP","90","51128  >  12345 [PSH, ACK] Seq=10 Ack=36 Win=83 Len=24 TSval=4177306908 TSecr=2581317250"
"25","14:47:07.718158409","10.0.0.6","10.0.0.2","TCP","66","12345  >  51128 [ACK] Seq=36 Ack=34 Win=85 Len=0 TSval=2581317250 TSecr=4177306908"
"26","14:47:07.718319764","10.0.0.6","10.0.0.1","TCP","70","12345  >  43206 [PSH, ACK] Seq=1 Ack=36 Win=85 Len=4 TSval=3085387027 TSecr=4205189420"
"27","14:47:07.718349578","10.0.0.1","10.0.0.6","TCP","66","43206  >  12345 [ACK] Seq=36 Ack=5 Win=83 Len=0 TSval=4205191628 TSecr=3085387027"
"28","14:47:07.718365964","10.0.0.6","10.0.0.1","TCP","70","12345  >  43206 [PSH, ACK] Seq=5 Ack=36 Win=85 Len=4 TSval=3085387027 TSecr=4205191628"
"29","14:47:07.718372210","10.0.0.1","10.0.0.6","TCP","66","43206  >  12345 [ACK] Seq=36 Ack=9 Win=83 Len=0 TSval=4205191628 TSecr=3085387027"
"30","14:47:07.718380767","10.0.0.6","10.0.0.1","TCP","67","12345  >  43206 [PSH, ACK] Seq=9 Ack=36 Win=85 Len=1 TSval=3085387027 TSecr=4205191628"
"31","14:47:07.718385454","10.0.0.1","10.0.0.6","TCP","66","43206  >  12345 [ACK] Seq=36 Ack=10 Win=83 Len=0 TSval=4205191628 TSecr=3085387027"
"32","14:47:07.718392296","10.0.0.6","10.0.0.1","TCP","90","12345  >  43206 [PSH, ACK] Seq=10 Ack=36 Win=85 Len=24 TSval=3085387027 TSecr=4205191628"
"33","14:47:07.718396481","10.0.0.1","10.0.0.6","TCP","66","43206  >  12345 [ACK] Seq=36 Ack=34 Win=83 Len=0 TSval=4205191628 TSecr=3085387027"
"34","14:47:09.926870516","10.0.0.1","10.0.0.6","TCP","70","43206  >  12345 [PSH, ACK] Seq=36 Ack=34 Win=83 Len=4 TSval=4205193836 TSecr=3085387027"
"35","14:47:09.926895026","10.0.0.6","10.0.0.1","TCP","66","12345  >  43206 [ACK] Seq=34 Ack=40 Win=85 Len=0 TSval=3085389235 TSecr=4205193836"
"36","14:47:09.926914212","10.0.0.1","10.0.0.6","TCP","70","43206  >  12345 [PSH, ACK] Seq=40 Ack=34 Win=83 Len=4 TSval=4205193836 TSecr=3085389235"
"37","14:47:09.926920796","10.0.0.6","10.0.0.1","TCP","66","12345  >  43206 [ACK] Seq=34 Ack=44 Win=85 Len=0 TSval=3085389235 TSecr=4205193836"
"38","14:47:09.926930009","10.0.0.1","10.0.0.6","TCP","67","43206  >  12345 [PSH, ACK] Seq=44 Ack=34 Win=83 Len=1 TSval=4205193836 TSecr=3085389235"
"39","14:47:09.926934676","10.0.0.6","10.0.0.1","TCP","66","12345  >  43206 [ACK] Seq=34 Ack=45 Win=85 Len=0 TSval=3085389235 TSecr=4205193836"
"40","14:47:09.926942170","10.0.0.1","10.0.0.6","TCP","92","43206  >  12345 [PSH, ACK] Seq=45 Ack=34 Win=83 Len=26 TSval=4205193836 TSecr=3085389235"
"41","14:47:09.926946721","10.0.0.6","10.0.0.1","TCP","66","12345  >  43206 [ACK] Seq=34 Ack=71 Win=85 Len=0 TSval=3085389235 TSecr=4205193836"
"42","14:47:09.927196974","10.0.0.6","10.0.0.2","TCP","70","12345  >  51128 [PSH, ACK] Seq=36 Ack=34 Win=85 Len=4 TSval=2581319460 TSecr=4177306908"
"43","14:47:09.927219882","10.0.0.2","10.0.0.6","TCP","66","51128  >  12345 [ACK] Seq=34 Ack=40 Win=83 Len=0 TSval=4177309118 TSecr=2581319460"
"44","14:47:09.927234974","10.0.0.6","10.0.0.2","TCP","70","12345  >  51128 [PSH, ACK] Seq=40 Ack=34 Win=85 Len=4 TSval=2581319460 TSecr=4177309118"
"45","14:47:09.927240974","10.0.0.2","10.0.0.6","TCP","66","51128  >  12345 [ACK] Seq=34 Ack=44 Win=83 Len=0 TSval=4177309118 TSecr=2581319460"
"46","14:47:09.927249504","10.0.0.6","10.0.0.2","TCP","67","12345  >  51128 [PSH, ACK] Seq=44 Ack=34 Win=85 Len=1 TSval=2581319460 TSecr=4177309118"
"47","14:47:09.927254159","10.0.0.2","10.0.0.6","TCP","66","51128  >  12345 [ACK] Seq=34 Ack=45 Win=83 Len=0 TSval=4177309118 TSecr=2581319460"
"48","14:47:09.927261460","10.0.0.6","10.0.0.2","TCP","92","12345  >  51128 [PSH, ACK] Seq=45 Ack=34 Win=85 Len=26 TSval=2581319460 TSecr=4177309118"
"49","14:47:09.927265994","10.0.0.2","10.0.0.6","TCP","66","51128  >  12345 [ACK] Seq=34 Ack=71 Win=83 Len=0 TSval=4177309118 TSecr=2581319460"
"50","14:47:12.132002166","10.0.0.2","10.0.0.6","TCP","70","51128  >  12345 [PSH, ACK] Seq=34 Ack=71 Win=83 Len=4 TSval=4177311322 TSecr=2581319460"
"51","14:47:12.132027299","10.0.0.6","10.0.0.2","TCP","66","12345  >  51128 [ACK] Seq=71 Ack=38 Win=85 Len=0 TSval=2581321664 TSecr=4177311322"
"52","14:47:12.132046784","10.0.0.2","10.0.0.6","TCP","70","51128  >  12345 [PSH, ACK] Seq=38 Ack=71 Win=83 Len=4 TSval=4177311322 TSecr=2581321664"
"53","14:47:12.132052830","10.0.0.6","10.0.0.2","TCP","66","12345  >  51128 [ACK] Seq=71 Ack=42 Win=85 Len=0 TSval=2581321664 TSecr=4177311322"
"54","14:47:12.132062126","10.0.0.2","10.0.0.6","TCP","67","51128  >  12345 [PSH, ACK] Seq=42 Ack=71 Win=83 Len=1 TSval=4177311322 TSecr=2581321664"
"55","14:47:12.132066755","10.0.0.6","10.0.0.2","TCP","66","12345  >  51128 [ACK] Seq=71 Ack=43 Win=85 Len=0 TSval=2581321664 TSecr=4177311322"
"56","14:47:12.132074959","10.0.0.2","10.0.0.6","TCP","90","51128  >  12345 [PSH, ACK] Seq=43 Ack=71 Win=83 Len=24 TSval=4177311322 TSecr=2581321664"
"57","14:47:12.132079446","10.0.0.6","10.0.0.2","TCP","66","12345  >  51128 [ACK] Seq=71 Ack=67 Win=85 Len=0 TSval=2581321664 TSecr=4177311322"
"58","14:47:12.132334127","10.0.0.6","10.0.0.1","TCP","70","12345  >  43206 [PSH, ACK] Seq=34 Ack=71 Win=85 Len=4 TSval=3085391441 TSecr=4205193836"
"59","14:47:12.132351449","10.0.0.1","10.0.0.6","TCP","66","43206  >  12345 [ACK] Seq=71 Ack=38 Win=83 Len=0 TSval=4205196042 TSecr=3085391441"
"60","14:47:12.132363648","10.0.0.6","10.0.0.1","TCP","70","12345  >  43206 [PSH, ACK] Seq=38 Ack=71 Win=85 Len=4 TSval=3085391441 TSecr=4205196042"
"61","14:47:12.132368735","10.0.0.1","10.0.0.6","TCP","66","43206  >  12345 [ACK] Seq=71 Ack=42 Win=83 Len=0 TSval=4205196042 TSecr=3085391441"
"62","14:47:12.132376013","10.0.0.6","10.0.0.1","TCP","67","12345  >  43206 [PSH, ACK] Seq=42 Ack=71 Win=85 Len=1 TSval=3085391441 TSecr=4205196042"
"63","14:47:12.132380220","10.0.0.1","10.0.0.6","TCP","66","43206  >  12345 [ACK] Seq=71 Ack=43 Win=83 Len=0 TSval=4205196042 TSecr=3085391441"
"64","14:47:12.132387185","10.0.0.6","10.0.0.1","TCP","90","12345  >  43206 [PSH, ACK] Seq=43 Ack=71 Win=85 Len=24 TSval=3085391441 TSecr=4205196042"
"65","14:47:12.132391177","10.0.0.1","10.0.0.6","TCP","66","43206  >  12345 [ACK] Seq=71 Ack=67 Win=83 Len=0 TSval=4205196042 TSecr=3085391441"
"66","14:47:14.340203688","10.0.0.1","10.0.0.6","TCP","70","43206  >  12345 [PSH, ACK] Seq=71 Ack=67 Win=83 Len=4 TSval=4205198250 TSecr=3085391441"
"67","14:47:14.340229130","10.0.0.6","10.0.0.1","TCP","66","12345  >  43206 [ACK] Seq=67 Ack=75 Win=85 Len=0 TSval=3085393649 TSecr=4205198250"
"68","14:47:14.340247199","10.0.0.1","10.0.0.6","TCP","70","43206  >  12345 [PSH, ACK] Seq=75 Ack=67 Win=83 Len=4 TSval=4205198250 TSecr=3085393649"
"69","14:47:14.340253123","10.0.0.6","10.0.0.1","TCP","66","12345  >  43206 [ACK] Seq=67 Ack=79 Win=85 Len=0 TSval=3085393649 TSecr=4205198250"
"70","14:47:14.340261644","10.0.0.1","10.0.0.6","TCP","67","43206  >  12345 [PSH, ACK] Seq=79 Ack=67 Win=83 Len=1 TSval=4205198250 TSecr=3085393649"
"71","14:47:14.340265789","10.0.0.6","10.0.0.1","TCP","66","12345  >  43206 [ACK] Seq=67 Ack=80 Win=85 Len=0 TSval=3085393649 TSecr=4205198250"
"72","14:47:14.340273072","10.0.0.1","10.0.0.6","TCP","92","43206  >  12345 [PSH, ACK] Seq=80 Ack=67 Win=83 Len=26 TSval=4205198250 TSecr=3085393649"
"73","14:47:14.340277036","10.0.0.6","10.0.0.1","TCP","66","12345  >  43206 [ACK] Seq=67 Ack=106 Win=85 Len=0 TSval=3085393649 TSecr=4205198250"
"74","14:47:14.344446968","10.0.0.6","10.0.0.2","TCP","70","12345  >  51128 [PSH, ACK] Seq=71 Ack=67 Win=85 Len=4 TSval=2581323877 TSecr=4177311322"
"75","14:47:14.344478385","10.0.0.2","10.0.0.6","TCP","66","51128  >  12345 [ACK] Seq=67 Ack=75 Win=83 Len=0 TSval=4177313535 TSecr=2581323877"
"76","14:47:14.344495464","10.0.0.6","10.0.0.2","TCP","70","12345  >  51128 [PSH, ACK] Seq=75 Ack=67 Win=85 Len=4 TSval=2581323877 TSecr=4177313535"
"77","14:47:14.344502073","10.0.0.2","10.0.0.6","TCP","66","51128  >  12345 [ACK] Seq=67 Ack=79 Win=83 Len=0 TSval=4177313535 TSecr=2581323877"
"78","14:47:14.344510680","10.0.0.6","10.0.0.2","TCP","67","12345  >  51128 [PSH, ACK] Seq=79 Ack=67 Win=85 Len=1 TSval=2581323877 TSecr=4177313535"
"79","14:47:14.344515100","10.0.0.2","10.0.0.6","TCP","66","51128  >  12345 [ACK] Seq=67 Ack=80 Win=83 Len=0 TSval=4177313535 TSecr=2581323877"
"80","14:47:14.344525461","10.0.0.6","10.0.0.2","TCP","92","12345  >  51128 [PSH, ACK] Seq=80 Ack=67 Win=85 Len=26 TSval=2581323877 TSecr=4177313535"
"81","14:47:14.344530233","10.0.0.2","10.0.0.6","TCP","66","51128  >  12345 [ACK] Seq=67 Ack=106 Win=83 Len=0 TSval=4177313535 TSecr=2581323877"
"82","14:47:16.545093198","10.0.0.2","10.0.0.6","TCP","70","51128  >  12345 [PSH, ACK] Seq=67 Ack=106 Win=83 Len=4 TSval=4177315735 TSecr=2581323877"
"83","14:47:16.545119786","10.0.0.6","10.0.0.2","TCP","66","12345  >  51128 [ACK] Seq=106 Ack=71 Win=85 Len=0 TSval=2581326077 TSecr=4177315735"
"84","14:47:16.545139075","10.0.0.2","10.0.0.6","TCP","70","51128  >  12345 [PSH, ACK] Seq=71 Ack=106 Win=83 Len=4 TSval=4177315735 TSecr=2581326077"
"85","14:47:16.545145333","10.0.0.6","10.0.0.2","TCP","66","12345  >  51128 [ACK] Seq=106 Ack=75 Win=85 Len=0 TSval=2581326077 TSecr=4177315735"
"86","14:47:16.545154453","10.0.0.2","10.0.0.6","TCP","67","51128  >  12345 [PSH, ACK] Seq=75 Ack=106 Win=83 Len=1 TSval=4177315735 TSecr=2581326077"
"87","14:47:16.545158765","10.0.0.6","10.0.0.2","TCP","66","12345  >  51128 [ACK] Seq=106 Ack=76 Win=85 Len=0 TSval=2581326077 TSecr=4177315735"
"88","14:47:16.545166442","10.0.0.2","10.0.0.6","TCP","90","51128  >  12345 [PSH, ACK] Seq=76 Ack=106 Win=83 Len=24 TSval=4177315735 TSecr=2581326077"
"89","14:47:16.545170581","10.0.0.6","10.0.0.2","TCP","66","12345  >  51128 [ACK] Seq=106 Ack=100 Win=85 Len=0 TSval=2581326077 TSecr=4177315735"
"90","14:47:16.545622738","10.0.0.6","10.0.0.1","TCP","70","12345  >  43206 [PSH, ACK] Seq=67 Ack=106 Win=85 Len=4 TSval=3085395854 TSecr=4205198250"
"91","14:47:16.545641180","10.0.0.1","10.0.0.6","TCP","66","43206  >  12345 [ACK] Seq=106 Ack=71 Win=83 Len=0 TSval=4205200455 TSecr=3085395854"
"92","14:47:16.545659154","10.0.0.6","10.0.0.1","TCP","70","12345  >  43206 [PSH, ACK] Seq=71 Ack=106 Win=85 Len=4 TSval=3085395854 TSecr=4205200455"
"93","14:47:16.545664554","10.0.0.1","10.0.0.6","TCP","66","43206  >  12345 [ACK] Seq=106 Ack=75 Win=83 Len=0 TSval=4205200455 TSecr=3085395854"
"94","14:47:16.545672257","10.0.0.6","10.0.0.1","TCP","67","12345  >  43206 [PSH, ACK] Seq=75 Ack=106 Win=85 Len=1 TSval=3085395854 TSecr=4205200455"
"95","14:47:16.545676749","10.0.0.1","10.0.0.6","TCP","66","43206  >  12345 [ACK] Seq=106 Ack=76 Win=83 Len=0 TSval=4205200455 TSecr=3085395854"
"96","14:47:16.545683236","10.0.0.6","10.0.0.1","TCP","90","12345  >  43206 [PSH, ACK] Seq=76 Ack=106 Win=85 Len=24 TSval=3085395854 TSecr=4205200455"
"97","14:47:16.545687729","10.0.0.1","10.0.0.6","TCP","66","43206  >  12345 [ACK] Seq=106 Ack=100 Win=83 Len=0 TSval=4205200455 TSecr=3085395854"
"98","14:47:18.749704039","10.0.0.1","10.0.0.6","TCP","70","43206  >  12345 [PSH, ACK] Seq=106 Ack=100 Win=83 Len=4 TSval=4205202659 TSecr=3085395854"
"99","14:47:18.749729772","10.0.0.6","10.0.0.1","TCP","66","12345  >  43206 [ACK] Seq=100 Ack=110 Win=85 Len=0 TSval=3085398058 TSecr=4205202659"
"100","14:47:18.749762509","10.0.0.1","10.0.0.6","TCP","70","43206  >  12345 [PSH, ACK] Seq=110 Ack=100 Win=83 Len=4 TSval=4205202659 TSecr=3085398058"
"101","14:47:18.749771929","10.0.0.1","10.0.0.6","TCP","67","43206  >  12345 [PSH, ACK] Seq=114 Ack=100 Win=83 Len=1 TSval=4205202659 TSecr=3085398058"
"102","14:47:18.749779186","10.0.0.1","10.0.0.6","TCP","92","43206  >  12345 [PSH, ACK] Seq=115 Ack=100 Win=83 Len=26 TSval=4205202659 TSecr=3085398058"
"103","14:47:18.749779748","10.0.0.6","10.0.0.1","TCP","66","12345  >  43206 [ACK] Seq=100 Ack=114 Win=85 Len=0 TSval=3085398058 TSecr=4205202659"
"104","14:47:18.749794953","10.0.0.6","10.0.0.1","TCP","66","12345  >  43206 [ACK] Seq=100 Ack=115 Win=85 Len=0 TSval=3085398058 TSecr=4205202659"
"105","14:47:18.749801877","10.0.0.6","10.0.0.1","TCP","66","12345  >  43206 [ACK] Seq=100 Ack=141 Win=85 Len=0 TSval=3085398058 TSecr=4205202659"
"106","14:47:18.752899710","10.0.0.6","10.0.0.2","TCP","70","12345  >  51128 [PSH, ACK] Seq=106 Ack=100 Win=85 Len=4 TSval=2581328285 TSecr=4177315735"
"107","14:47:18.752922330","10.0.0.2","10.0.0.6","TCP","66","51128  >  12345 [ACK] Seq=100 Ack=110 Win=83 Len=0 TSval=4177317943 TSecr=2581328285"
"108","14:47:18.752936266","10.0.0.6","10.0.0.2","TCP","70","12345  >  51128 [PSH, ACK] Seq=110 Ack=100 Win=85 Len=4 TSval=2581328285 TSecr=4177317943"
"109","14:47:18.752942583","10.0.0.2","10.0.0.6","TCP","66","51128  >  12345 [ACK] Seq=100 Ack=114 Win=83 Len=0 TSval=4177317943 TSecr=2581328285"
"110","14:47:18.752950541","10.0.0.6","10.0.0.2","TCP","67","12345  >  51128 [PSH, ACK] Seq=114 Ack=100 Win=85 Len=1 TSval=2581328285 TSecr=4177317943"
"111","14:47:18.752954935","10.0.0.2","10.0.0.6","TCP","66","51128  >  12345 [ACK] Seq=100 Ack=115 Win=83 Len=0 TSval=4177317943 TSecr=2581328285"
"112","14:47:18.752961706","10.0.0.6","10.0.0.2","TCP","92","12345  >  51128 [PSH, ACK] Seq=115 Ack=100 Win=85 Len=26 TSval=2581328285 TSecr=4177317943"
"113","14:47:18.752966007","10.0.0.2","10.0.0.6","TCP","66","51128  >  12345 [ACK] Seq=100 Ack=141 Win=83 Len=0 TSval=4177317943 TSecr=2581328285"
"114","14:47:20.954692282","10.0.0.2","10.0.0.6","TCP","70","51128  >  12345 [PSH, ACK] Seq=100 Ack=141 Win=83 Len=4 TSval=4177320145 TSecr=2581328285"
"115","14:47:20.954720482","10.0.0.6","10.0.0.2","TCP","66","12345  >  51128 [ACK] Seq=141 Ack=104 Win=85 Len=0 TSval=2581330487 TSecr=4177320145"
"116","14:47:20.954753009","10.0.0.2","10.0.0.6","TCP","70","51128  >  12345 [PSH, ACK] Seq=104 Ack=141 Win=83 Len=4 TSval=4177320145 TSecr=2581330487"
"117","14:47:20.954764964","10.0.0.6","10.0.0.2","TCP","66","12345  >  51128 [ACK] Seq=141 Ack=108 Win=85 Len=0 TSval=2581330487 TSecr=4177320145"
"118","14:47:20.954776233","10.0.0.2","10.0.0.6","TCP","67","51128  >  12345 [PSH, ACK] Seq=108 Ack=141 Win=83 Len=1 TSval=4177320145 TSecr=2581330487"
"119","14:47:20.954786138","10.0.0.6","10.0.0.2","TCP","66","12345  >  51128 [ACK] Seq=141 Ack=109 Win=85 Len=0 TSval=2581330487 TSecr=4177320145"
"120","14:47:20.954795044","10.0.0.2","10.0.0.6","TCP","90","51128  >  12345 [PSH, ACK] Seq=109 Ack=141 Win=83 Len=24 TSval=4177320145 TSecr=2581330487"
"121","14:47:20.954804646","10.0.0.6","10.0.0.2","TCP","66","12345  >  51128 [ACK] Seq=141 Ack=133 Win=85 Len=0 TSval=2581330487 TSecr=4177320145"
"122","14:47:20.954987760","10.0.0.6","10.0.0.1","TCP","70","12345  >  43206 [PSH, ACK] Seq=100 Ack=141 Win=85 Len=4 TSval=3085400263 TSecr=4205202659"
"123","14:47:20.955015984","10.0.0.1","10.0.0.6","TCP","66","43206  >  12345 [ACK] Seq=141 Ack=104 Win=83 Len=0 TSval=4205204864 TSecr=3085400263"
"124","14:47:20.955030998","10.0.0.6","10.0.0.1","TCP","70","12345  >  43206 [PSH, ACK] Seq=104 Ack=141 Win=85 Len=4 TSval=3085400263 TSecr=4205204864"
"125","14:47:20.955037405","10.0.0.1","10.0.0.6","TCP","66","43206  >  12345 [ACK] Seq=141 Ack=108 Win=83 Len=0 TSval=4205204864 TSecr=3085400263"
"126","14:47:20.955045638","10.0.0.6","10.0.0.1","TCP","67","12345  >  43206 [PSH, ACK] Seq=108 Ack=141 Win=85 Len=1 TSval=3085400263 TSecr=4205204864"
"127","14:47:20.955049947","10.0.0.1","10.0.0.6","TCP","66","43206  >  12345 [ACK] Seq=141 Ack=109 Win=83 Len=0 TSval=4205204864 TSecr=3085400263"
"128","14:47:20.955057005","10.0.0.6","10.0.0.1","TCP","90","12345  >  43206 [PSH, ACK] Seq=109 Ack=141 Win=85 Len=24 TSval=3085400263 TSecr=4205204864"
"129","14:47:20.955061143","10.0.0.1","10.0.0.6","TCP","66","43206  >  12345 [ACK] Seq=141 Ack=133 Win=83 Len=0 TSval=4205204864 TSecr=3085400263"
"130","14:47:23.162471877","10.0.0.1","10.0.0.6","TCP","70","43206  >  12345 [PSH, ACK] Seq=141 Ack=133 Win=83 Len=4 TSval=4205207072 TSecr=3085400263"
"131","14:47:23.162498773","10.0.0.6","10.0.0.1","TCP","66","12345  >  43206 [ACK] Seq=133 Ack=145 Win=85 Len=0 TSval=3085402471 TSecr=4205207072"
"132","14:47:23.162517250","10.0.0.1","10.0.0.6","TCP","70","43206  >  12345 [PSH, ACK] Seq=145 Ack=133 Win=83 Len=4 TSval=4205207072 TSecr=3085402471"
"133","14:47:23.162523665","10.0.0.6","10.0.0.1","TCP","66","12345  >  43206 [ACK] Seq=133 Ack=149 Win=85 Len=0 TSval=3085402471 TSecr=4205207072"
"134","14:47:23.162532922","10.0.0.1","10.0.0.6","TCP","67","43206  >  12345 [PSH, ACK] Seq=149 Ack=133 Win=83 Len=1 TSval=4205207072 TSecr=3085402471"
"135","14:47:23.162537191","10.0.0.6","10.0.0.1","TCP","66","12345  >  43206 [ACK] Seq=133 Ack=150 Win=85 Len=0 TSval=3085402471 TSecr=4205207072"
"136","14:47:23.162544215","10.0.0.1","10.0.0.6","TCP","92","43206  >  12345 [PSH, ACK] Seq=150 Ack=133 Win=83 Len=26 TSval=4205207072 TSecr=3085402471"
"137","14:47:23.162548234","10.0.0.6","10.0.0.1","TCP","66","12345  >  43206 [ACK] Seq=133 Ack=176 Win=85 Len=0 TSval=3085402471 TSecr=4205207072"
"138","14:47:23.165637177","10.0.0.6","10.0.0.2","TCP","70","12345  >  51128 [PSH, ACK] Seq=141 Ack=133 Win=85 Len=4 TSval=2581332698 TSecr=4177320145"
"139","14:47:23.165666893","10.0.0.2","10.0.0.6","TCP","66","51128  >  12345 [ACK] Seq=133 Ack=145 Win=83 Len=0 TSval=4177322356 TSecr=2581332698"
"140","14:47:23.165682574","10.0.0.6","10.0.0.2","TCP","70","12345  >  51128 [PSH, ACK] Seq=145 Ack=133 Win=85 Len=4 TSval=2581332698 TSecr=4177322356"
"141","14:47:23.165688854","10.0.0.2","10.0.0.6","TCP","66","51128  >  12345 [ACK] Seq=133 Ack=149 Win=83 Len=0 TSval=4177322356 TSecr=2581332698"
"142","14:47:23.165697036","10.0.0.6","10.0.0.2","TCP","67","12345  >  51128 [PSH, ACK] Seq=149 Ack=133 Win=85 Len=1 TSval=2581332698 TSecr=4177322356"
"143","14:47:23.165701613","10.0.0.2","10.0.0.6","TCP","66","51128  >  12345 [ACK] Seq=133 Ack=150 Win=83 Len=0 TSval=4177322356 TSecr=2581332698"
"144","14:47:23.165708628","10.0.0.6","10.0.0.2","TCP","92","12345  >  51128 [PSH, ACK] Seq=150 Ack=133 Win=85 Len=26 TSval=2581332698 TSecr=4177322356"
"145","14:47:23.165713218","10.0.0.2","10.0.0.6","TCP","66","51128  >  12345 [ACK] Seq=133 Ack=176 Win=83 Len=0 TSval=4177322356 TSecr=2581332698"
"146","14:47:25.375044255","10.0.0.2","10.0.0.6","TCP","70","51128  >  12345 [PSH, ACK] Seq=133 Ack=176 Win=83 Len=4 TSval=4177324565 TSecr=2581332698"
"147","14:47:25.375067485","10.0.0.6","10.0.0.2","TCP","66","12345  >  51128 [ACK] Seq=176 Ack=137 Win=85 Len=0 TSval=2581334907 TSecr=4177324565"
"148","14:47:25.375085514","10.0.0.2","10.0.0.6","TCP","70","51128  >  12345 [PSH, ACK] Seq=137 Ack=176 Win=83 Len=4 TSval=4177324565 TSecr=2581334907"
"149","14:47:25.375091524","10.0.0.6","10.0.0.2","TCP","66","12345  >  51128 [ACK] Seq=176 Ack=141 Win=85 Len=0 TSval=2581334907 TSecr=4177324565"
"150","14:47:25.375100215","10.0.0.2","10.0.0.6","TCP","67","51128  >  12345 [PSH, ACK] Seq=141 Ack=176 Win=83 Len=1 TSval=4177324565 TSecr=2581334907"
"151","14:47:25.375104433","10.0.0.6","10.0.0.2","TCP","66","12345  >  51128 [ACK] Seq=176 Ack=142 Win=85 Len=0 TSval=2581334907 TSecr=4177324565"
"152","14:47:25.375111983","10.0.0.2","10.0.0.6","TCP","90","51128  >  12345 [PSH, ACK] Seq=142 Ack=176 Win=83 Len=24 TSval=4177324565 TSecr=2581334907"
"153","14:47:25.375115962","10.0.0.6","10.0.0.2","TCP","66","12345  >  51128 [ACK] Seq=176 Ack=166 Win=85 Len=0 TSval=2581334907 TSecr=4177324565"
"154","14:47:25.375341289","10.0.0.6","10.0.0.1","TCP","70","12345  >  43206 [PSH, ACK] Seq=133 Ack=176 Win=85 Len=4 TSval=3085404684 TSecr=4205207072"
"155","14:47:25.375362617","10.0.0.1","10.0.0.6","TCP","66","43206  >  12345 [ACK] Seq=176 Ack=137 Win=83 Len=0 TSval=4205209285 TSecr=3085404684"
"156","14:47:25.375377934","10.0.0.6","10.0.0.1","TCP","70","12345  >  43206 [PSH, ACK] Seq=137 Ack=176 Win=85 Len=4 TSval=3085404684 TSecr=4205209285"
"157","14:47:25.375384433","10.0.0.1","10.0.0.6","TCP","66","43206  >  12345 [ACK] Seq=176 Ack=141 Win=83 Len=0 TSval=4205209285 TSecr=3085404684"
"158","14:47:25.375393041","10.0.0.6","10.0.0.1","TCP","67","12345  >  43206 [PSH, ACK] Seq=141 Ack=176 Win=85 Len=1 TSval=3085404684 TSecr=4205209285"
"159","14:47:25.375397684","10.0.0.1","10.0.0.6","TCP","66","43206  >  12345 [ACK] Seq=176 Ack=142 Win=83 Len=0 TSval=4205209285 TSecr=3085404684"
"160","14:47:25.375404608","10.0.0.6","10.0.0.1","TCP","90","12345  >  43206 [PSH, ACK] Seq=142 Ack=176 Win=85 Len=24 TSval=3085404684 TSecr=4205209285"
"161","14:47:25.375408981","10.0.0.1","10.0.0.6","TCP","66","43206  >  12345 [ACK] Seq=176 Ack=166 Win=83 Len=0 TSval=4205209285 TSecr=3085404684"
"162","14:47:27.581194397","10.0.0.1","10.0.0.6","TCP","70","43206  >  12345 [PSH, ACK] Seq=176 Ack=166 Win=83 Len=4 TSval=4205211490 TSecr=3085404684"
"163","14:47:27.581219618","10.0.0.6","10.0.0.1","TCP","66","12345  >  43206 [ACK] Seq=166 Ack=180 Win=85 Len=0 TSval=3085406890 TSecr=4205211490"
"164","14:47:27.581238751","10.0.0.1","10.0.0.6","TCP","70","43206  >  12345 [PSH, ACK] Seq=180 Ack=166 Win=83 Len=4 TSval=4205211491 TSecr=3085406890"
"165","14:47:27.581245370","10.0.0.6","10.0.0.1","TCP","66","12345  >  43206 [ACK] Seq=166 Ack=184 Win=85 Len=0 TSval=3085406890 TSecr=4205211491"
"166","14:47:27.581253986","10.0.0.1","10.0.0.6","TCP","67","43206  >  12345 [PSH, ACK] Seq=184 Ack=166 Win=83 Len=1 TSval=4205211491 TSecr=3085406890"
"167","14:47:27.581258144","10.0.0.6","10.0.0.1","TCP","66","12345  >  43206 [ACK] Seq=166 Ack=185 Win=85 Len=0 TSval=3085406890 TSecr=4205211491"
"168","14:47:27.581265300","10.0.0.1","10.0.0.6","TCP","92","43206  >  12345 [PSH, ACK] Seq=185 Ack=166 Win=83 Len=26 TSval=4205211491 TSecr=3085406890"
"169","14:47:27.581269410","10.0.0.6","10.0.0.1","TCP","66","12345  >  43206 [ACK] Seq=166 Ack=211 Win=85 Len=0 TSval=3085406890 TSecr=4205211491"
"170","14:47:27.581507821","10.0.0.6","10.0.0.2","TCP","70","12345  >  51128 [PSH, ACK] Seq=176 Ack=166 Win=85 Len=4 TSval=2581337114 TSecr=4177324565"
"171","14:47:27.581524772","10.0.0.2","10.0.0.6","TCP","66","51128  >  12345 [ACK] Seq=166 Ack=180 Win=83 Len=0 TSval=4177326772 TSecr=2581337114"
"172","14:47:27.581536249","10.0.0.6","10.0.0.2","TCP","70","12345  >  51128 [PSH, ACK] Seq=180 Ack=166 Win=85 Len=4 TSval=2581337114 TSecr=4177326772"
"173","14:47:27.581541445","10.0.0.2","10.0.0.6","TCP","66","51128  >  12345 [ACK] Seq=166 Ack=184 Win=83 Len=0 TSval=4177326772 TSecr=2581337114"
"174","14:47:27.581548693","10.0.0.6","10.0.0.2","TCP","67","12345  >  51128 [PSH, ACK] Seq=184 Ack=166 Win=85 Len=1 TSval=2581337114 TSecr=4177326772"
"175","14:47:27.581552962","10.0.0.2","10.0.0.6","TCP","66","51128  >  12345 [ACK] Seq=166 Ack=185 Win=83 Len=0 TSval=4177326772 TSecr=2581337114"
"176","14:47:27.581559642","10.0.0.6","10.0.0.2","TCP","92","12345  >  51128 [PSH, ACK] Seq=185 Ack=166 Win=85 Len=26 TSval=2581337114 TSecr=4177326772"
"177","14:47:27.581563926","10.0.0.2","10.0.0.6","TCP","66","51128  >  12345 [ACK] Seq=166 Ack=211 Win=83 Len=0 TSval=4177326772 TSecr=2581337114"
"178","14:47:28.619011603","fe80::8098:3eff:feb4:c94a","ff02::2","ICMPv6","70","Router Solicitation from 82:98:3e:b4:c9:4a"
"179","14:47:28.619019783","fe80::a06e:94ff:fe3c:9f1b","ff02::2","ICMPv6","70","Router Solicitation from a2:6e:94:3c:9f:1b"
"180","14:47:28.619289562","fe80::2cea:cfff:fee0:9950","ff02::2","ICMPv6","70","Router Solicitation from 2e:ea:cf:e0:99:50"
"181","14:47:29.792526214","10.0.0.2","10.0.0.6","TCP","70","51128  >  12345 [PSH, ACK] Seq=166 Ack=211 Win=83 Len=4 TSval=4177328983 TSecr=2581337114"
"182","14:47:29.792551491","10.0.0.6","10.0.0.2","TCP","66","12345  >  51128 [ACK] Seq=211 Ack=170 Win=85 Len=0 TSval=2581339325 TSecr=4177328983"
"183","14:47:29.792570476","10.0.0.2","10.0.0.6","TCP","70","51128  >  12345 [PSH, ACK] Seq=170 Ack=211 Win=83 Len=4 TSval=4177328983 TSecr=2581339325"
"184","14:47:29.792577066","10.0.0.6","10.0.0.2","TCP","66","12345  >  51128 [ACK] Seq=211 Ack=174 Win=85 Len=0 TSval=2581339325 TSecr=4177328983"
"185","14:47:29.792585988","10.0.0.2","10.0.0.6","TCP","67","51128  >  12345 [PSH, ACK] Seq=174 Ack=211 Win=83 Len=1 TSval=4177328983 TSecr=2581339325"
"186","14:47:29.792590221","10.0.0.6","10.0.0.2","TCP","66","12345  >  51128 [ACK] Seq=211 Ack=175 Win=85 Len=0 TSval=2581339325 TSecr=4177328983"
"187","14:47:29.792597490","10.0.0.2","10.0.0.6","TCP","90","51128  >  12345 [PSH, ACK] Seq=175 Ack=211 Win=83 Len=24 TSval=4177328983 TSecr=2581339325"
"188","14:47:29.792601614","10.0.0.6","10.0.0.2","TCP","66","12345  >  51128 [ACK] Seq=211 Ack=199 Win=85 Len=0 TSval=2581339325 TSecr=4177328983"
"189","14:47:29.793374928","10.0.0.6","10.0.0.1","TCP","70","12345  >  43206 [PSH, ACK] Seq=166 Ack=211 Win=85 Len=4 TSval=3085409102 TSecr=4205211491"
"190","14:47:29.793392735","10.0.0.1","10.0.0.6","TCP","66","43206  >  12345 [ACK] Seq=211 Ack=170 Win=83 Len=0 TSval=4205213703 TSecr=3085409102"
"191","14:47:29.793405099","10.0.0.6","10.0.0.1","TCP","70","12345  >  43206 [PSH, ACK] Seq=170 Ack=211 Win=85 Len=4 TSval=3085409102 TSecr=4205213703"
"192","14:47:29.793410378","10.0.0.1","10.0.0.6","TCP","66","43206  >  12345 [ACK] Seq=211 Ack=174 Win=83 Len=0 TSval=4205213703 TSecr=3085409102"
"193","14:47:29.793417733","10.0.0.6","10.0.0.1","TCP","67","12345  >  43206 [PSH, ACK] Seq=174 Ack=211 Win=85 Len=1 TSval=3085409102 TSecr=4205213703"
"194","14:47:29.793421908","10.0.0.1","10.0.0.6","TCP","66","43206  >  12345 [ACK] Seq=211 Ack=175 Win=83 Len=0 TSval=4205213703 TSecr=3085409102"
"195","14:47:29.793428439","10.0.0.6","10.0.0.1","TCP","90","12345  >  43206 [PSH, ACK] Seq=175 Ack=211 Win=85 Len=24 TSval=3085409102 TSecr=4205213703"
"196","14:47:29.793432429","10.0.0.1","10.0.0.6","TCP","66","43206  >  12345 [ACK] Seq=211 Ack=199 Win=83 Len=0 TSval=4205213703 TSecr=3085409102"
"197","14:47:30.667269057","fe80::3c03:74ff:feb8:e498","ff02::2","ICMPv6","70","Router Solicitation from 3e:03:74:b8:e4:98"
"198","14:47:32.001381339","10.0.0.1","10.0.0.6","TCP","70","43206  >  12345 [PSH, ACK] Seq=211 Ack=199 Win=83 Len=4 TSval=4205215911 TSecr=3085409102"
"199","14:47:32.001405216","10.0.0.6","10.0.0.1","TCP","66","12345  >  43206 [ACK] Seq=199 Ack=215 Win=85 Len=0 TSval=3085411310 TSecr=4205215911"
"200","14:47:32.001424267","10.0.0.1","10.0.0.6","TCP","70","43206  >  12345 [PSH, ACK] Seq=215 Ack=199 Win=83 Len=4 TSval=4205215911 TSecr=3085411310"
"201","14:47:32.001430624","10.0.0.6","10.0.0.1","TCP","66","12345  >  43206 [ACK] Seq=199 Ack=219 Win=85 Len=0 TSval=3085411310 TSecr=4205215911"
"202","14:47:32.001439592","10.0.0.1","10.0.0.6","TCP","67","43206  >  12345 [PSH, ACK] Seq=219 Ack=199 Win=83 Len=1 TSval=4205215911 TSecr=3085411310"
"203","14:47:32.001444010","10.0.0.6","10.0.0.1","TCP","66","12345  >  43206 [ACK] Seq=199 Ack=220 Win=85 Len=0 TSval=3085411310 TSecr=4205215911"
"204","14:47:32.001451194","10.0.0.1","10.0.0.6","TCP","92","43206  >  12345 [PSH, ACK] Seq=220 Ack=199 Win=83 Len=26 TSval=4205215911 TSecr=3085411310"
"205","14:47:32.001455111","10.0.0.6","10.0.0.1","TCP","66","12345  >  43206 [ACK] Seq=199 Ack=246 Win=85 Len=0 TSval=3085411310 TSecr=4205215911"
"206","14:47:32.003044129","10.0.0.6","10.0.0.2","TCP","70","12345  >  51128 [PSH, ACK] Seq=211 Ack=199 Win=85 Len=4 TSval=2581341535 TSecr=4177328983"
"207","14:47:32.003064663","10.0.0.2","10.0.0.6","TCP","66","51128  >  12345 [ACK] Seq=199 Ack=215 Win=83 Len=0 TSval=4177331193 TSecr=2581341535"
"208","14:47:32.003082684","10.0.0.6","10.0.0.2","TCP","70","12345  >  51128 [PSH, ACK] Seq=215 Ack=199 Win=85 Len=4 TSval=2581341535 TSecr=4177331193"
"209","14:47:32.003088883","10.0.0.2","10.0.0.6","TCP","66","51128  >  12345 [ACK] Seq=199 Ack=219 Win=83 Len=0 TSval=4177331193 TSecr=2581341535"
"210","14:47:32.003096893","10.0.0.6","10.0.0.2","TCP","67","12345  >  51128 [PSH, ACK] Seq=219 Ack=199 Win=85 Len=1 TSval=2581341535 TSecr=4177331193"
"211","14:47:32.003101433","10.0.0.2","10.0.0.6","TCP","66","51128  >  12345 [ACK] Seq=199 Ack=220 Win=83 Len=0 TSval=4177331193 TSecr=2581341535"
"212","14:47:32.003108023","10.0.0.6","10.0.0.2","TCP","92","12345  >  51128 [PSH, ACK] Seq=220 Ack=199 Win=85 Len=26 TSval=2581341535 TSecr=4177331193"
"213","14:47:32.003112256","10.0.0.2","10.0.0.6","TCP","66","51128  >  12345 [ACK] Seq=199 Ack=246 Win=83 Len=0 TSval=4177331193 TSecr=2581341535"
"214","14:47:32.091344772","10.0.0.3","10.0.0.6","TCP","554","1736  >  12345 [SYN] Seq=0 Win=512 Len=500"
"215","14:47:32.091440515","10.0.0.3","10.0.0.6","TCP","554","1737  >  12345 [SYN] Seq=0 Win=512 Len=500"
"216","14:47:32.091567457","10.0.0.6","10.0.0.3","TCP","58","12345  >  1736 [SYN, ACK] Seq=0 Ack=1 Win=42340 Len=0 MSS=1460"
"217","14:47:32.091639222","10.0.0.6","10.0.0.3","TCP","58","12345  >  1737 [SYN, ACK] Seq=0 Ack=1 Win=42340 Len=0 MSS=1460"
"218","14:47:32.091665684","10.0.0.3","10.0.0.6","TCP","54","1736  >  12345 [RST] Seq=1 Win=0 Len=0"
"219","14:47:32.091728723","10.0.0.3","10.0.0.6","TCP","54","1737  >  12345 [RST] Seq=1 Win=0 Len=0"
"220","14:47:32.427176938","10.0.0.3","10.0.0.6","TCP","554","50196  >  12345 [SYN] Seq=0 Win=512 Len=500"
"221","14:47:32.427205239","10.0.0.6","10.0.0.3","TCP","58","12345  >  50196 [SYN, ACK] Seq=0 Ack=1 Win=42340 Len=0 MSS=1460"
"222","14:47:32.507791928","10.0.0.5","10.0.0.6","TCP","554","1736  >  12345 [SYN] Seq=0 Win=512 Len=500"
"223","14:47:32.507934574","10.0.0.6","10.0.0.5","TCP","58","12345  >  1736 [SYN, ACK] Seq=0 Ack=1 Win=42340 Len=0 MSS=1460"
"224","14:47:32.507951739","10.0.0.5","10.0.0.6","TCP","554","1737  >  12345 [SYN] Seq=0 Win=512 Len=500"
"225","14:47:32.507973573","10.0.0.6","10.0.0.5","TCP","58","12345  >  1737 [SYN, ACK] Seq=0 Ack=1 Win=42340 Len=0 MSS=1460"
"226","14:47:32.507996546","10.0.0.5","10.0.0.6","TCP","54","1736  >  12345 [RST] Seq=1 Win=0 Len=0"
"227","14:47:32.508057414","10.0.0.5","10.0.0.6","TCP","54","1737  >  12345 [RST] Seq=1 Win=0 Len=0"
"228","14:47:32.843634963","10.0.0.5","10.0.0.6","TCP","554","34580  >  12345 [SYN] Seq=0 Win=512 Len=500"
"229","14:47:32.843667929","10.0.0.6","10.0.0.5","TCP","58","12345  >  34580 [SYN, ACK] Seq=0 Ack=1 Win=42340 Len=0 MSS=1460"
"230","14:47:32.859178201","10.0.0.3","10.0.0.6","TCP","554","46951  >  12345 [SYN] Seq=0 Win=512 Len=500"
"231","14:47:32.859207724","10.0.0.6","10.0.0.3","TCP","58","12345  >  46951 [SYN, ACK] Seq=0 Ack=1 Win=42340 Len=0 MSS=1460"
"232","14:47:32.925099431","10.0.0.4","10.0.0.6","TCP","554","1736  >  12345 [SYN] Seq=0 Win=512 Len=500"
"233","14:47:32.925112628","10.0.0.4","10.0.0.6","TCP","554","1737  >  12345 [SYN] Seq=0 Win=512 Len=500"
"234","14:47:32.925297191","10.0.0.6","10.0.0.4","TCP","58","12345  >  1736 [SYN, ACK] Seq=0 Ack=1 Win=42340 Len=0 MSS=1460"
"235","14:47:32.925307646","10.0.0.6","10.0.0.4","TCP","58","12345  >  1737 [SYN, ACK] Seq=0 Ack=1 Win=42340 Len=0 MSS=1460"
"236","14:47:32.925382417","10.0.0.4","10.0.0.6","TCP","54","1736  >  12345 [RST] Seq=1 Win=0 Len=0"
"237","14:47:32.925398565","10.0.0.4","10.0.0.6","TCP","54","1737  >  12345 [RST] Seq=1 Win=0 Len=0"
"238","14:47:33.268751017","10.0.0.4","10.0.0.6","TCP","554","28261  >  12345 [SYN] Seq=0 Win=512 Len=500"
"239","14:47:33.268782607","10.0.0.6","10.0.0.4","TCP","58","12345  >  28261 [SYN, ACK] Seq=0 Ack=1 Win=42340 Len=0 MSS=1460"
"240","14:47:33.275622682","10.0.0.5","10.0.0.6","TCP","554","4142  >  12345 [SYN] Seq=0 Win=512 Len=500"
"241","14:47:33.275644720","10.0.0.6","10.0.0.5","TCP","58","12345  >  4142 [SYN, ACK] Seq=0 Ack=1 Win=42340 Len=0 MSS=1460"
"242","14:47:33.291178204","10.0.0.3","10.0.0.6","TCP","554","18176  >  12345 [SYN] Seq=0 Win=512 Len=500"
"243","14:47:33.291209352","10.0.0.6","10.0.0.3","TCP","58","12345  >  18176 [SYN, ACK] Seq=0 Ack=1 Win=42340 Len=0 MSS=1460"
"244","14:47:33.450986845","10.0.0.6","10.0.0.3","TCP","58","[TCP Retransmission] 12345  >  50196 [SYN, ACK] Seq=0 Ack=1 Win=42340 Len=0 MSS=1460"
"245","14:47:33.451019573","10.0.0.3","10.0.0.6","TCP","54","50196  >  12345 [RST] Seq=1 Win=0 Len=0"
"246","14:47:33.692653570","10.0.0.4","10.0.0.6","TCP","554","49572  >  12345 [SYN] Seq=0 Win=512 Len=500"
"247","14:47:33.692691169","10.0.0.6","10.0.0.4","TCP","58","12345  >  49572 [SYN, ACK] Seq=0 Ack=1 Win=42340 Len=0 MSS=1460"
"248","14:47:33.707630573","10.0.0.5","10.0.0.6","TCP","554","44921  >  12345 [SYN] Seq=0 Win=512 Len=500"
"249","14:47:33.707668541","10.0.0.6","10.0.0.5","TCP","58","12345  >  44921 [SYN, ACK] Seq=0 Ack=1 Win=42340 Len=0 MSS=1460"
"250","14:47:33.755210879","10.0.0.3","10.0.0.6","TCP","554","63238  >  12345 [SYN] Seq=0 Win=512 Len=500"
"251","14:47:33.755248204","10.0.0.6","10.0.0.3","TCP","58","12345  >  63238 [SYN, ACK] Seq=0 Ack=1 Win=42340 Len=0 MSS=1460"
"252","14:47:33.866981103","10.0.0.6","10.0.0.3","TCP","58","[TCP Retransmission] 12345  >  46951 [SYN, ACK] Seq=0 Ack=1 Win=42340 Len=0 MSS=1460"
"253","14:47:33.866984334","10.0.0.6","10.0.0.5","TCP","58","[TCP Retransmission] 12345  >  34580 [SYN, ACK] Seq=0 Ack=1 Win=42340 Len=0 MSS=1460"
"254","14:47:33.867015539","10.0.0.3","10.0.0.6","TCP","54","46951  >  12345 [RST] Seq=1 Win=0 Len=0"
"255","14:47:33.867017750","10.0.0.5","10.0.0.6","TCP","54","34580  >  12345 [RST] Seq=1 Win=0 Len=0"
"256","14:47:34.124661389","10.0.0.4","10.0.0.6","TCP","554","18120  >  12345 [SYN] Seq=0 Win=512 Len=500"
"257","14:47:34.124700506","10.0.0.6","10.0.0.4","TCP","58","12345  >  18120 [SYN, ACK] Seq=0 Ack=1 Win=42340 Len=0 MSS=1460"
"258","14:47:34.171633733","10.0.0.5","10.0.0.6","TCP","554","9284  >  12345 [SYN] Seq=0 Win=512 Len=500"
"259","14:47:34.171667849","10.0.0.6","10.0.0.5","TCP","58","12345  >  9284 [SYN, ACK] Seq=0 Ack=1 Win=42340 Len=0 MSS=1460"
"260","14:47:34.219179523","10.0.0.3","10.0.0.6","TCP","554","31865  >  12345 [SYN] Seq=0 Win=512 Len=500"
"261","14:47:34.219217261","10.0.0.6","10.0.0.3","TCP","58","12345  >  31865 [SYN, ACK] Seq=0 Ack=1 Win=42340 Len=0 MSS=1460"
"262","14:47:34.282994816","10.0.0.6","10.0.0.5","TCP","58","[TCP Retransmission] 12345  >  4142 [SYN, ACK] Seq=0 Ack=1 Win=42340 Len=0 MSS=1460"
"263","14:47:34.282999593","10.0.0.6","10.0.0.4","TCP","58","[TCP Retransmission] 12345  >  28261 [SYN, ACK] Seq=0 Ack=1 Win=42340 Len=0 MSS=1460"
"264","14:47:34.283035227","10.0.0.5","10.0.0.6","TCP","54","4142  >  12345 [RST] Seq=1 Win=0 Len=0"
"265","14:47:34.283037146","10.0.0.4","10.0.0.6","TCP","54","28261  >  12345 [RST] Seq=1 Win=0 Len=0"
"266","14:47:34.296244829","10.0.0.2","10.0.0.6","TCP","70","51128  >  12345 [PSH, ACK] Seq=199 Ack=246 Win=83 Len=4 TSval=4177333487 TSecr=2581341535"
"267","14:47:34.296274937","10.0.0.6","10.0.0.2","TCP","66","12345  >  51128 [ACK] Seq=246 Ack=203 Win=85 Len=0 TSval=2581343829 TSecr=4177333487"
"268","14:47:34.296297005","10.0.0.2","10.0.0.6","TCP","70","51128  >  12345 [PSH, ACK] Seq=203 Ack=246 Win=83 Len=4 TSval=4177333487 TSecr=2581343829"
"269","14:47:34.296303910","10.0.0.6","10.0.0.2","TCP","66","12345  >  51128 [ACK] Seq=246 Ack=207 Win=85 Len=0 TSval=2581343829 TSecr=4177333487"
"270","14:47:34.296314296","10.0.0.2","10.0.0.6","TCP","67","51128  >  12345 [PSH, ACK] Seq=207 Ack=246 Win=83 Len=1 TSval=4177333487 TSecr=2581343829"
"271","14:47:34.296319328","10.0.0.6","10.0.0.2","TCP","66","12345  >  51128 [ACK] Seq=246 Ack=208 Win=85 Len=0 TSval=2581343829 TSecr=4177333487"
"272","14:47:34.296327751","10.0.0.2","10.0.0.6","TCP","90","51128  >  12345 [PSH, ACK] Seq=208 Ack=246 Win=83 Len=24 TSval=4177333487 TSecr=2581343829"
"273","14:47:34.296332213","10.0.0.6","10.0.0.2","TCP","66","12345  >  51128 [ACK] Seq=246 Ack=232 Win=85 Len=0 TSval=2581343829 TSecr=4177333487"
"274","14:47:34.300250116","10.0.0.6","10.0.0.1","TCP","70","12345  >  43206 [PSH, ACK] Seq=199 Ack=246 Win=85 Len=4 TSval=3085413609 TSecr=4205215911"
"275","14:47:34.300279197","10.0.0.1","10.0.0.6","TCP","66","43206  >  12345 [ACK] Seq=246 Ack=203 Win=83 Len=0 TSval=4205218210 TSecr=3085413609"
"276","14:47:34.300298118","10.0.0.6","10.0.0.1","TCP","70","12345  >  43206 [PSH, ACK] Seq=203 Ack=246 Win=85 Len=4 TSval=3085413609 TSecr=4205218210"
"277","14:47:34.300304815","10.0.0.1","10.0.0.6","TCP","66","43206  >  12345 [ACK] Seq=246 Ack=207 Win=83 Len=0 TSval=4205218210 TSecr=3085413609"
"278","14:47:34.300313575","10.0.0.6","10.0.0.1","TCP","67","12345  >  43206 [PSH, ACK] Seq=207 Ack=246 Win=85 Len=1 TSval=3085413609 TSecr=4205218210"
"279","14:47:34.300318532","10.0.0.1","10.0.0.6","TCP","66","43206  >  12345 [ACK] Seq=246 Ack=208 Win=83 Len=0 TSval=4205218210 TSecr=3085413609"
"280","14:47:34.300326141","10.0.0.6","10.0.0.1","TCP","90","12345  >  43206 [PSH, ACK] Seq=208 Ack=246 Win=85 Len=24 TSval=3085413609 TSecr=4205218210"
"281","14:47:34.300330776","10.0.0.1","10.0.0.6","TCP","66","43206  >  12345 [ACK] Seq=246 Ack=232 Win=83 Len=0 TSval=4205218210 TSecr=3085413609"
"282","14:47:34.315083179","10.0.0.6","10.0.0.3","TCP","58","[TCP Retransmission] 12345  >  18176 [SYN, ACK] Seq=0 Ack=1 Win=42340 Len=0 MSS=1460"
